Unnamed: 0,Artist and Title,Artist,Year,main_genre,genres,first_genre,second_genre,third_genre,Streams,Daily,Title,lyrics
1831,Metric - Black Sheep,Metric,2010,Indie/Alternative,"['canadian indie', 'canadian rock', 'indie rock', 'indietronica', 'metropopolis', 'neo-synthpop']",canadian indie,canadian rock,indie rock,147516564,78080,,"[Intro] Black sheep, come home Black sheep, come home Black sheep, come home Black sheep, come home Black sheep, come home (Oh, yeah) Black sheep, come home Black sheep, come home Black sheep, come home Black sheep, come home (Oh, yeah) Black sheep, come home Black sheep, come home Black sheep, come home Black sheep, come home Black sheep, come home (Oh, yeah) Black sheep, come home [Verse 1] Hello again Friend of a friend, I knew you when Our common goal was waiting for the world to end [Pre-Chorus] Now that the truth is just a rule that you can bend You crack the whip, shape-shift and trick, the past again [Chorus] Send you my love on a wire Lift you up, every time Everyone, ooh, ooh Pulls away, ooh, ooh From you, ooh [Post-Chorus] Ooh, ooh Ooh, ooh Ooh, ooh [Instrumental Break] [Verse 2] Got balls of steel Got an automobile for a minimum wage Got real estate, I'm buying it all up in outer space [Pre-Chorus] Now that the truth is just a rule that you can bend You crack the whip, shape-shift and trick, the past again [Chorus] Send you my love on a wire Lift you up, every time Everyone, ooh, ooh Pulls away, ooh, ooh It's a mechanical bull, the number one You'll take a ride from anyone Everyone wants a ride Pulls away, ooh, ooh From you, ooh [Post-Chorus] Ooh, ooh Ooh, ooh Ooh, ooh Ooh, ooh Ooh, ooh Ooh, ooh Ooh, ooh [Instrumental Break] [Outro] Ooh, ooh Ooh, ooh Ooh, ooh Ooh, ooh"
1804,3OH!3 - My First Kiss,3OH!3,2010,Pop,"['dance pop', 'electropowerpop', 'pop punk', 'pop rap', 'post-teen pop']",dance pop,electropowerpop,pop punk,147278322,50205,,"[Intro: Sean Foreman & Ke$ha] My first kiss went a little like this And twist, and twist Well, my first kiss went a little like this And twist, and twist [Verse 1: Sean Foreman] I said no more teachers and no more books I got a kiss under the bleachers, hoping that nobody looked Lips like liquorice, tongue like candy Excuse me miss, but can I get you out your panties? [Pre-Chorus: Nathaniel Motte, Nathaniel Motte & Ke$ha] In the back of the car, on the way to the bar I got you on my lips (I got you on my lips) At the foot of the stairs with my fingers in your hair Baby, this is it [Chorus: Sean Foreman & Nathaniel Motte] She won't ever get enough once she gets a little touch If I had it my way, you know that I'd make her say Ooooooh.... Ooooooh... She won't ever get enough once she gets a little touch If I had it my way, you know that I'd make her say Ooooooh.... Ooooooh... [Post-Chorus: Ke$ha] Well, my first kiss went a little like this [Verse 2: Sean Foreman] I said no more sailors and no more soldiers With your name in a heart tattooed upon the shoulders Your kiss is like whiskey, it gets me drunk And I wake up in the morning with the taste of your tongue [Pre-Chorus: Nathaniel Motte & Ke$ha, Nathaniel Motte] In the back of the car, on the way to the bar I got you on my lips (I got you on my lips) At the foot of the stairs with my fingers in your hair Baby, this is it (Ohh) [Chorus: Sean Foreman & Nathaniel Motte] She won't ever get enough once she gets a little touch If I had it my way, you know that I'd make her say Ooooooh.... Ooooooh... She won't ever get enough once she gets a little touch If I had it my way, you know that I'd make her say Ooooooh.... Ooooooh... [Refrain: Sean Foreman & Ke$ha] My first kiss went a little like this And twist, and twist Well, my first kiss went a little like this And twist, and twist [Bridge: Sean Foreman & Nathaniel Motte] (Yeah) She won't ever get enough once she gets a little touch If I had it my way, you know that I'd make her say Ooooooh.... [Chorus: Sean Foreman & Nathaniel Motte] She won't ever get enough once she gets a little touch If I had it my way, you know that I'd make her say Ooooooh.... Ooooooh... She won't ever get enough once she gets a little touch If I had it my way, you know that I'd make her say Ooooooh.... Ooooooh... She won't ever get enough once she gets a little touch If I had it my way, you know that I'd make her say Ooooooh.... Ooooooh... She won't ever get enough once she gets a little touch If I had it my way, you know that I'd make her say"
1785,Plain White T's - Rhythm Of Love,Plain White T's,2010,Rock,"['modern rock', 'neo mellow', 'neon pop punk', 'pop punk', 'pop rock']",modern rock,neo mellow,neon pop punk,147135537,34430,,"[Verse 1] My head is stuck in the clouds She begs me to come down Says, ""Boy, quit foolin' around"" I told her, ""I love the view from up here Warm sun and wind in my ear We'll watch the world from above As it turns to the rhythm of love"" [Chorus] We may only have tonight But 'til the morning sun, you're mine All mine Play the music low And sway to the rhythm of love [Verse 2] My heart beats like a drum A guitar string to the strum A beautiful song to be sung She's got blue eyes deep like the sea That roll back when she's laughing at me She rises up like the tide The moment her lips meet mine [Chorus] We may only have tonight But 'til the morning sun, you're mine All mine Play the music low And sway to the rhythm of love [Bridge] When the moon is low We can dance in slow motion And all your tears will subside All your tears will dry Bop ba (bop ba) bop ba Bop ba (bop ba) bop ba Da da da dum da da dum Bop ba (bop ba) bop ba Bop ba (bop ba) bop ba Da da da dum da da dum [Verse 3] And long after I've gone You'll still be humming along And I will keep you in my mind The way you make love so fine [Chorus] We may only have tonight But 'til the morning sun, you're mine All mine Play the music low And sway to the rhythm of love Oh, play the music low And sway to the rhythm of love Yeah, sway to the rhythm of love"
1836,Nicki Minaj - Your Love,Nicki Minaj,2010,Pop,"['hip pop', 'pop', 'queens hip hop', 'rap']",hip pop,pop,queens hip hop,146676560,63818,,"[Chorus] Shorty, I'ma only tell you this once, you the illest (Ba, ba-da, da, doh) And for your loving, I'ma die hard like Bruce Willis (Ba, ba-da, da, doh) You got spark, you, you got spunk You, you got something all the girls want You're like a candy store (Love) and I'm a toddler (Love) You got me wanting more and m-m-more of Your love, your love (Yeah) Your love, your love (Yeah) Your love, your love (Yeah) Your love, your love (Yeah) Your love, your love Your love, your love Your love, your love (Uh) Your love, your love (Uh, yo) [Verse 1] He the type to pop tags and be cockin' the brim Might breeze through The Ave, might stop at the gym And he keep a do-rag, keep the wave on swim W-w-waves on swim so they hate on him Anyway, I think I met him sometime before In a different life or where I record I mean he was Adam, I think I was Eve But my vision ends with the apple on the tree ""S"" on my chest 'cause I'm ready to save him Ready to get buck on anybody that plays him And I think I love him, I love him just like I raised him When he call me ""mama, lil' mama,"" I call him ""baby"" [Chorus] Shorty, I'ma only tell you this once, you the illest (Ba, ba-da, da, doh) And for your loving, I'ma die hard like Bruce Willis (Ba, ba-da, da, doh) You got spark, you, you got spunk You, you got something all the girls want You're like a candy store (Love) and I'm a toddler (Love) You got me wanting more and m-m-more of Your love, your love (Yeah) Your love, your love (Yeah) Your love, your love (Yeah) Your love, your love (Yeah) Your love, your love Your love, your love Your love, your love (Mmhmm) Your love, your love (Yo, yo) [Verse 2] He the type to keep a couple hundred grand in a rubber band Just left Money Gram in the lemon Lamb' Hot damn, make me scream like Summer Jam I mean that nigga must be from the motherland Anyway, I think I met him in the sky When I was a Geisha, he was a Samurai Somehow, I understood him when he spoke Thai Never spoke lies and he never broke fly ""S"" on my chest, let me get my cape on He's so thugged out, Ghostface and Raekwon Convict just like Akon 'Cause you know the snitches be putting the jake on [Chorus] Shorty, I'ma only tell you this once, you the illest (Ba, ba-da, da, doh) And for your loving, I'ma die hard like Bruce Willis (Ba, ba-da, da, doh) You got spark, you, you got spunk You, you got something all the girls want You're like a candy store (Love) and I'm a toddler (Love) You got me wanting more and m-m-more of Your love, your love (Yeah) Your love, your love (Yeah) Your love, your love (Yeah) Your love, your love (Yeah) Your love, your love Your love, your love Your love, your love Your love, your love [Outro] Find me in the dark I'll be in the stars Find me in your heart I'm in need of your love Your love, your love Your love Baby, you're the illest Your love Your love"
1793,Jessie J - Do It Like A Dude,Jessie J,2010,Pop,"['modern country pop', 'singer-songwriter pop']",modern country pop,singer-songwriter pop,Unknown,146453792,44468,,"[Intro] Hey, hey, hey, hey Hey, hey, hey, hey Hey, hey, hey, hey Hey, hey, hey, hey (J-J-J-J-Jessie J) [Verse 1] Stomp, stomp, I've arrived Drop the beat, nasty face, why ya lookin' at me? Flyin', flyin', flyin', flyin' through the sky In my spaceship, I'm an alien tonight [Pre-Chorus] Dirty, dirty, dirty, dirty, dirty, dirty sucker You think I can't get hurt like you, you motherfucker? [Chorus] I can do it like a brother, do it like a dude Grab my crotch, wear my hat low like you Do it like a brother, do it like a dude Grab my crotch, wear my hat low like you We can do it like the mandem, mandem, hey We can do it like the mandem, sugar, sugar, sugar We can do it like the mandem, mandem, hey We can do it like the mandem, sugar, sugar, sugar [Verse 2] Bong, bong (Hey), pour me a beer No pretty drinks, I'm a guy out here Rollin', rollin', rollin', rollin' money like a pimp My B-I-T-C-H is on my dick, like this [Pre-Chorus] Dirty, dirty, dirty, dirty, dirty, dirty sucker You think I can't get hurt like you, you motherfucker? [Chorus] I can do it like a brother, do it like a dude Grab my crotch, wear my hat low like you Do it like a brother, do it like a dude Grab my crotch, wear my hat low like you We can do it like the mandem, mandem, hey We can do it like the mandem, sugar, sugar, sugar We can do it like the mandem, mandem, hey We can do it like the mandem, sugar, sugar, sugar [Bridge] Boys, come-come say what you wanna Boys, you-you need to lick my dollar Boys, g-gettin' hot under the collar Holla, holla, whoa (Ooh, whoa) Boys, come-come say what you wanna (Come say it) Boys, you-you need to lick my dollar (Lick my dollar, dollar) Boys, g-gettin' hot under the collar (Yeah, okay) Holla, holla, whoa (Break it down) [Breakdown] I can do it like a brother, do it like a dude Grab my crotch, wear my hat low like you Do it like a brother, do it like a dude Grab my crotch, wear my hat low like you [Chorus] I can do it like a brother, do it like a dude (Brother, du-dude) Grab my crotch, wear my hat low like you Do it like a brother, do it like a dude (Brother, du-dude) Grab my crotch, wear my hat low like you We can do it like the mandem, mandem, hey (Ma-ma-ma-ma, ma-ma-ma-ma) We can do it like the mandem, sugar, sugar, sugar (Ma-ma-ma-ma, ah) We can do it like the mandem, mandem, hey (Ma-ma-ma-ma, ma-ma-ma-ma) We can do it like the mandem, sugar, sugar, sugar (Yeah) [Outro] Do it, do it like a dude (Okay) Do it, do it low like you Do it, do it like a dude Do it, do it, do it like a dude"
,Thompson Square - Are You Gonna Kiss Me Or Not,Thompson Square,2010,,,,,,145696562,35918,Are You Gonna Kiss Me Or Not,"[Verse 1: Keifer] We were sitting up there on your momma's roof Talking 'bout everything under the moon With the smell of honeysuckle and your perfume All I could think about was my next move [Verse 2: Keifer] Oh but you were so shy, so was I Maybe that's why it was so hard to believe When you smiled and said to me [Chorus: Keifer & Shawna] Are you gonna kiss me or not? Are we gonna do this or what? I think you know I like you a lot But you're about to miss your shot Are you gonna kiss me or what? [Verse 3: Keifer] It was the best dang kiss that I ever had Except for that long one after that And I knew if I wanted this thing to last Sooner or later I'd have to ask for your hand [Verse 4: Keifer] So I took a chance Bought a wedding band and I got down on one knee And you smiled and said to me [Chorus: Keifer & Shawna] Are you gonna kiss me or not? Are we gonna do this or what? I think you know I love you a lot I think we've got a real good shot Are you gonna kiss me or not? [Verse 5] [Keifer & Shawna] So we planned it all out for the middle of June From the wedding cake to the honeymoon [Keifer] And your momma cried When you walked down the aisle [Verse 6] [Keifer & Shawna] When the preacher man said, ""Say I do"" I did and you did too [Keifer] Then I lifted that veil And saw your pretty smile and I said Are you gonna kiss me or not? [Chorus: Keifer & Shawna] Are we gonna do this or what? Look at all the love that we got It ain't never gonna stop Are you gonna kiss me or not? [Tag] [Keifer] Yeah baby I love you a lot [Keifer & Shawna] I really think we've got a shot [Keifer] Are you gonna kiss me or not?"
1811,Victorious Cast - Beggin' On Your Knees,Victorious Cast,2010,Pop,['post-teen pop'],post-teen pop,Unknown,Unknown,145190449,66922,,"[Verse 1] You had it all The day you told me, told me you want me I had it all But let you fool me, fool me completely Yeah, I was so stupid to give you all my attention 'Cause the way you played me Exposed your true intentions [Chorus] And one day I'll have you beggin' on your knees for me Yeah, one day I'll have you crawlin' like a centipede You messed with me and messed with her So I'll make sure you get what you deserve Yeah, one day You'll be beggin' on your knees for me [Verse 2] So watch your back 'Cause you don't know when or where I could get you I've set the trap And when I'm done, then you'll know what I've been through So, oh, Mr. Player Do you feel like the man now? And I bet you're nervous 'Cause this song makes you freak out [Chorus] And one day I'll have you beggin' on your knees for me Yeah, one day I'll have you crawlin' like a centipede You messed with me (Yeah) and messed with her (Yeah) So I'll make sure you get what you deserve (Yeah) Yeah, one day You'll be beggin' on your knees for me [Bridge] I know I'm bein' bitter But I'ma drag you under 'Cause you just don't, don't deserve happy ever after For what you did to me After you told me you never felt that way It was only just a game [Pre-Chorus] (You had it all) And one day [Chorus] And one day I'll have you beggin' on your knees for me (Beggin' on your knees for me) Yeah, one day I'll have you crawlin' like a centipede (Crawlin' like a centipede) You messed with me (Yeah) and messed with her (Yeah) So I'll make sure you get what you deserve (Yeah) Yeah, one day You'll be beggin' on your knees for me"
1807,Thirty Seconds To Mars - Closer To The Edge,Thirty Seconds To Mars,2010,Rock,"['modern rock', 'post-grunge']",modern rock,post-grunge,Unknown,143936452,44248,,"[Verse 1] I don't remember the moment I tried to forget I lost myself, is it better not said Now I'm closer to the edge It was a thousand to one and a million to two Time to go down in flames and I'm taking you Closer to the edge [Chorus] No, I'm not saying I'm sorry One day maybe we'll meet again No, I'm not saying I'm sorry One day maybe we'll meet again No, no, no, no [Verse 2] (Can you, can you, can you, can you) Can you imagine a time when the truth ran free? The birth of a sun, the death of a dream Closer to the edge This never ending story Paid for with pride and faith We all fall short of glory Lost in our fate [Chorus] No, I'm not saying I'm sorry One day maybe we'll meet again No, I'm not saying I'm sorry One day maybe we'll meet again (No, no, no, no) [Bridge] (No, no, no, no) I will never forget (No, no) I will never regret  (No, no) I will live my life (No, no, no, no) I will never forget (No, no) I will never regret (No, no) I will live my life [Chorus] No, I'm not saying I'm sorry One day maybe we'll meet again (No, no) No, I'm not saying I'm sorry One day maybe we'll meet again (No, no, no, no) Closer to the edge Closer to the edge (No, no, no, no) Closer to the edge Closer to the edge (No, no, no, no) [Outro] Closer to the edge"
1848,Black Eyed Peas - Don’t Stop The Party,Black Eyed Peas,2010,Pop,"['dance pop', 'pop', 'pop rap']",dance pop,pop,pop rap,143487256,85179,,"[Intro: will.i.am] Don't, don't, don't, don't, don't, don't Don't, don't, don't, don't stop the party Don't, don't, don't, don't, don't, don't Stop, stop, stop The, the, the, don't stop the party [Interlude: will.i.am] (Ay, my people, this is mega unstoppable) [Chorus: will.i.am] Don't stop the party Don't, don't, don't, don't, don't, don't Stop, stop, stop The, the, the, the party [Verse 1: will.i.am] This is that original, this has no identical You can't hack my digital, future aboriginal Get up off my genitals, I stay on that pinnacle Kill you with my lyricals, call me verbal criminal Send you to that clinical, subscribe you some chemicals Audio and visual, can't see me – invisible I'm old school like biblical, futuristic next level Never on that typical Will I stop? Oh never, no [Pre-Chorus: will.i.am & Fergie] I ain't gonna stop until I'm done (Don't stop it) I ain't gonna quit until I've won Now, baby, don't you stop it, stop it Now, baby, don't you stop it, stop it Now, baby, don't you stop it, stop it, stop it, stop it You can not stop us now I ain't gonna stop until I'm done (Don't stop it) I ain't gonna quit until I've won Now, baby, don't you stop it, stop it Now, baby, don't you stop it, stop it Now, baby, don't you stop it, stop it, stop it, stop it Even if you wanted to, you couldn't stop us now [Chorus: will.i.am] Don't stop the party Don't, don't, don't, don't, don't, stop, stop, stop The, the, the, don't stop the party Don't, don't, don't, don't, don't, stop, stop, stop The, the, the, don't stop the party [Verse 2: apl.de.ap] You could call me crazy man, every day I'm partying You could find me at the club, popping bottles mingling Ladies dancing to the jam, acting naughty, man, oh man Got me in the mood again, after-party partying Yeah, I keep it happening, taking shots whatever, man Party like a veteran, music is my medicine You won't find me settling, can't be stopped; I'm steppin' in Keep it going till the end, yeah, that's right, here we go again [Verse 3: Taboo] I'm that one that lights it up, we red-hot like firetrucks Burn that book cause that's whassup, tell that DJ turn it up We dropping, that music, for people all around Keep rocking, head knocking, cause they can't shut us down [Bridge: will.i.am] And ain't no stoppin', we gon' keep on rocking Baby, ain't no stoppin', you can not stop us now [Pre-Chorus: will.i.am & Fergie] I ain't gonna stop until I'm done (Don't stop it) I ain't gonna quit until I've won Now, baby, don't you stop it, stop it Now, baby, don't you stop it, stop it Now, baby, don't you stop it, stop it, stop it, stop it You can't stop us now I ain't gonna stop until I'm done (don't stop it) I ain't gonna quit until I've won Now, baby, don't you stop it, stop it Now, baby, don't you stop it, stop it Now, baby, don't you stop it, stop it, stop it, stop it Even if you wanted to, you couldn't stop us now [Instrumental Break] [Chorus: will.i.am] Don't stop the party Don't, don't, don't, don't, don't, don't Stop, stop, stop, stop The, the, the, don't stop the party Don't, don't, don't, don't, don't, don't Stop, stop, stop, stop The, the, the, don't stop the party Don't, don't, don't, don't, don't, don't Stop, stop, stop, stop The, the, the, don't stop the party Don't, don't, don't, don't, don't, don't Stop, stop, stop, stop The, the, the, don't stop the party"
1862,Duck Sauce - Barbra Streisand,Duck Sauce,2010,Electronic/Dance,['disco house'],disco house,Unknown,Unknown,143044067,55584,,"[Intro: Barbra Streisand] New York is the place of opportunities. If there's any place in this world that you want to come to, to be able to make it big, or to go after your dreams, it's New York City Wooo, wooo, wooo-ooh [Chorus] Barbra Streisand Wooo, wooo, wooo-ooh, wooo, wooo, wooo-ooh Wooo, wooo, wooo-ooh, wooo, wooo, wooo Barbra Streisand Wooo, wooo, wooo-ooh, wooo, wooo, wooo-ooh Wooo, wooo, wooo-ooh, wooo, wooo, wooo Barbra Streisand Wooo, wooo, wooo-ooh, wooo, wooo, wooo-ooh Wooo, wooo, wooo-ooh, wooo, wooo, wooo-ooh Wooo, wooo, wooo-ooh, wooo, wooo, wooo-ooh Wooo, wooo, wooo-ooh, wooo, wooo, wooo [Bridge] So rough, baby, baby, baby, baby, baby So rough, Barbra, Barbra, Barbra, Barbra, Barbra So rough, baby, baby, baby, baby, baby So rough, Barbra, Barbra, Barbra, Barbra, Barbra So rough, baby, baby, baby, baby, baby So rough, Barbra, Barbra, Barbra, Barbra, Barbra So rough, baby, baby, baby, baby, baby So rough, Barbra, Barbra, Barbra, Barbra Streisand [Chorus] Wooo, wooo, wooo-ooh, wooo, wooo, wooo-ooh Wooo, wooo, wooo-ooh, wooo, wooo, wooo Barbra Streisand Woo, woo, wooo-ooh, wooo, wooo, wooo-ooh Woo, woo, wooo-ooh, wooo, wooo, wooo-ooh Barbra Streisand Woooooo, wooo-ooh, woooooo, wooo-ooh Wooo, wooo, wooo-ooh, woooooo, wooo-ooh Woooooo, wooo-ooh, wooo, wooo, wooo-ooh Barbra Streisand (Everybody loves Duck Sauce, isn't this amazing? This is amazing!) Wooo, wooo, wooo-ooh, wooo, wooo, wooo-ooh Wooo, wooo, wooo-ooh, wooo, wooo, wooo-ooh [Outro: P1,  P2 ,  P3  &  P4 ] Yeah, yeah, I'll fucking, I'll fucking take you to the farmers market And get you the freshest veggies and shit Like, like, they serve at Whole Foods Yeah, I'll fucking, yeah, I'll fucking, yeah I'll take you antiquing And buy you the nicest doll house. Hand-painted! Oh shit. I, alright, I'll fucking, I'll fucking Take you horseback-riding on the white sands of sunny Portugal Motherfucker! I'll fucking take you to Martha's Vineyard to go Clamming and shit, eat some bisque on the wing of clam chowder Up in this beast Yeah I'll fucking, I'll set up a juice cleanse for both of us We'll do the master cleanse, and I'll help you get the Mental clarity that you always wanted And help you with your IBS! I'll fucking, I'll fucking, I'll fucking take you to a Yoga Ashram and shit, in fucking Toronto Yo, I'll fucking help you type out your resume with the finest fonts! And set up your business plan! And I'll say that you're proficient at Microsoft Excel And that you have good planning skills! Sounds nice, son!"
,Glenn Miller - In The Mood,Glenn Miller,2010,,,,,,141468236,62086,In The Mood,"The man in the moon is sure a friend of mine That funny old moon is sure my lucky sign The man in the moon brought me a thrill divine When he helped me find the one I love He sent down a beam that came from paradise A silvery stream that took me by surprise A wonderful dream was right before my eyes That is how I found the one I love... How would I have known that she was lonely? So lonely and blue, she had been crying, too How would I have known that she was waiting For someone to care and her whole life to share? The man in the moon kept smiling up on high That funny old moon kept winking with his eye The man in the moon near tumbled from the sky When he helped me find the one I love!"
,Deftones - Diamond Eyes,Deftones,2010,,,,,,141309017,106645,Diamond Eyes,"[Verse 1] To the edge, till we all get off I will take you away With me, once and for all [Chorus] Time will see us realign Diamonds rain across the sky Shower me into the same realm [Verse 2] Calculate our embrace, hold on Come with me now Run away, outer space With me, once and for all [Chorus] Time will see us realign Diamonds rain across the sky Shower me into the same realm Time will see us realign Diamonds rain across the sky I will lead us to the same realm [Interlude] Get set [Break] When the coffin shakes And the needle breaks [Verse 3] Come, run away with me Come on, you'll see Once and for all [Chorus] Time will see us realign Diamonds rain across the sky Shower me into the same realm Time will lead us to the same realm I will lead us to the same realm"
