Unnamed: 0,Artist and Title,Artist,Year,main_genre,genres,first_genre,second_genre,third_genre,Streams,Daily,Title,lyrics
1643,Calle 13 - Muerte En Hawaii,Calle 13,2010,World/Traditional,"['latin afrobeat', 'latin alternative', 'latin hip hop', 'latin rock', 'puerto rican rock', 'rap conciencia', 'reggaeton', 'rock en espanol']",latin afrobeat,latin alternative,latin hip hop,403555646,147358,,"[Letra de ""Muerte en Hawaii""] [Verso 1] Yo he peleado con cocodrilos Me he balanceado sobre un hilo cargando más de quinientos kilos Le he dado la vuelta al mundo en menos de un segundo He cruza'o cien laberintos y nunca me confundo Respiro dentro y fuera del agua como las focas Soy a prueba de fuego, agarro balas con la boca Mi creatividad vuela como los aviones Puedo construir un cerebro sin leer las instrucciones Hablo todos los idiomas de todos los abecedarios Tengo más vocabulario que cualquier diccionario Tengo vista de águila, olfato de perro Puedo caminar descalzo sobre clavos de hierro Soy inmune a la muerte No necesito bendiciones porque siempre tengo buena suerte Ven conmigo a dar un paseo por el parque Porque tengo más cuentos que contarte, que García Márquez [Coro] Por ti, todo lo que hago lo hago por ti Es que tú me sacas lo mejor de mí Soy todo lo que soy Porque tú eres todo lo que quiero Por ti, todo lo que hago lo hago por ti Es que tú me sacas lo mejor de mí Soy todo lo que soy Porque tú eres todo lo que quiero [Verso 2] Puedo brincar la cuerda con solo una pierna Veo en la oscuridad sin usar una linterna Cocino lo que quieras, yo soy todo un chef Tengo sexo 24/7, todo el mes Puedo soplar las nubes grises pa' que tengas un buen día También sé cómo comunicarme por telepatía Por ti, cruzo la frontera sin visa Y le saco una buena sonrisa a la Mona Lisa Por ti, respiro antes de morirme Por ti voy a la iglesia y escucho toda la misa sin dormirme Sigo siendo el rey, aunque no tenga reino Mi sudor huele a perfume y nunca me despeino Sé pelear todas las artes marciales También se cómo comunicarme con los animales Mientras más pasa el tiempo me veo más joven Esta canción la compuse sin escuchar, como Beethoven [Coro] Por ti, todo lo que hago lo hago por ti Es que tú me sacas lo mejor de mí Soy todo lo que soy Porque tú eres todo lo que quiero Por ti, todo lo que hago lo hago por ti Es que tú me sacas lo mejor de mí Soy todo lo que soy Porque tú eres todo lo que quiero [Outro Instrumental]"
1654,Black Eyed Peas - The Time (Dirty Bit),Black Eyed Peas,2010,Pop,"['dance pop', 'pop', 'pop rap']",dance pop,pop,pop rap,398591546,197407,,"[Intro: will.i.am] This is international Big mega radio smasher [Chorus: will.i.am, Fergie, Both] I had the time of my life And I've never felt this way before And I swear, this is true And I owe it all to you Oh, I   had the time of my life And I've never felt this way before And I swear, this is true And I owe it all to you-you [Build: Fergie] You, you, you, you, you, you, you, you You-you-you-you-you-you-you-you Ou-ou-ou-ou-ou-ou-ou-ou-ou-ou-ou-ou [Drop: will.i.am] Dirty bit Dirty bit [Verse 1: will.i.am] I-I came up in here to rock, light a fire, make it hot I don't wanna take no pictures, I just wanna take some shots So come on, let's go, let's lose control Let's do it all night 'til we can't do it no more People rockin' to the sound, turn it up and watch it pound We gon' rock it to the top until the roof come burnin' down Yeah, it's hot in here, the temperature Has got these ladies gettin' freakier [Verse 2: Fergie] I got freaky, freaky, baby, I was chillin' with my ladies I didn't come to get bougie, I came here to get crazy I was born to get wild, that's my style If you didn't know that, well, baby, now you know now [Pre-Chorus: Taboo & Fergie] 'Cause I'm havin' A good time with you, I'm tellin' you [Chorus: will.i.am, Fergie, Both] I had the time of my life And I've never felt this way before And I swear, this is true And I owe it all to you Oh, I   had the time of my life And I've never felt this way before And I swear, this is true And I owe it all to you-you [Build: Fergie] You, you, you, you, you, you, you, you You-you-you-you-you-you-you-you Ou-ou-ou-ou-ou-ou-ou-ou-ou-ou-ou-ou [Drop: will.i.am] Dirty bit Dirty bit [Verse 3: apl.de.ap] All-All these girls, they like my swagger, they callin' me Mick Jagger I be rollin' like a Stone, jet-setter, jet-lagger We ain't messin' with no maggots, messin' with the baddest Chicks in the club, honey, what's up? Mirror, mirror on the wall, who's the baddest of them all? Yeah, it's gotta be the apl, I'm the mack daddy, y'all Haters better step back, ladies, download your app I'm the party application, rockin' just like that [Interlude: will.i.am] This is international Big mega radio smasher [Pre-Chorus: Taboo & Fergie] 'Cause I'm havin' A good time with you, I'm tellin' you [Chorus: will.i.am & Fergie] I-I-I-I had the time of my li-i-i— And I've never felt this way before-fore And I swear-wear, this is tru-u-u-ue And I owe it all to you-ou Oh, I-I-I-I had the time of my li-i-i— And I've never felt this way before-fore And I swear-wear, this is tru-u-u-u-ue And I owe it all to you I-I-I-I had the time of my li-i-i— And I've never felt this way before-fore And I swear-wear, this is tru-u-u-ue And I owe it all to you-ou Oh, I-I-I-I had the time of my li-i-i— And I've never felt this way before-fore And I swear-wear, this is tru-u-u-u-ue And I owe it all to you [Post-Chorus: will.i.am] Dirty bit [Outro: will.i.am] Welcome, this is The Beginning For every ending is mega starter When they bring the dark, we bring the light Let's go"
1653,Mohombi - Bumpy Ride,Mohombi,2010,,,,,,392473944,155846,,"[Chorus] I wanna boom-bang-bang with your body, oh We gonna rough it up before we take it slow Girl, let me rock you, rock you like a rodeo It's gonna be a bumpy ride I wanna boom-bang-bang with your body, oh We gonna rough it up before we take it slow Girl, let me rock you, rock you like a rodeo It's gonna be a bumpy ride I wanna boom-bang-bang with your body, oh We gonna rough it up before we take it slow Girl, let me rock you, rock you like a rodeo (Mohambi) It's gonna be a bumpy ride (RedOne, man) [Verse 1] I'm gonna pull you over, pull you under Make your body surrender to mine (Ooh-ayy-oh) Girl, you can make me suffer, do whatever 'Cause I know you're one of a kind (Ooh-ayy-oh) [Pre-Chorus] Tell me, who can love you? (Nobody) Hold you? (Nobody) Make your body wine like me You'll never find someone like me Who can love you? (Nobody) Hold you? (Nobody) Make your body wine like me You'll never find someone like me [Chorus] I wanna boom-bang-bang with your body, oh We gonna rough it up before we take it slow Girl, let me rock you, rock you like a rodeo It's gonna be a bumpy ride I wanna boom-bang-bang with your body, oh We gonna rough it up before we take it slow Girl, let me rock you, rock you like a rodeo It's gonna be a bumpy ride [Verse 2] I'ma spin you 'round, push your buttons Oh, I ain't plannin' to stop (Ooh-ayy-oh) Let me take you down to the bottom Work you all the way to the top (Ooh-ayy-oh) [Pre-Chorus] Tell me, who can love you? (Nobody) Hold you? (Nobody) Make your body wine like me You'll never find someone like me Who can love you? (Nobody) Hold you? (Nobody) Make your body wine like me You'll never find someone like me [Chorus] I wanna boom-bang-bang with your body, oh We gonna rough it up before we take it slow Girl, let me rock you, rock you like a rodeo It's gonna be a bumpy ride I wanna boom-bang-bang with your body, oh We gonna rough it up before we take it slow Girl, let me rock you, rock you like a rodeo It's gonna be a bumpy ride I wanna boom-bang-bang with your body, oh We gonna rough it up before we take it slow Girl, let me rock you, rock you like a rodeo It's gonna be a bumpy ride [Bridge] I'm on top of my love game And you gonna get it tonight I'm focused, I'm ready, girl I'm gonna give it to you right I'm gonna pull you over, pull you under Make your body surrender to mine Girl, you can make me suffer, do whatever 'Cause I know you're one of a kind (Ooh-ayy-oh) [Chorus] I wanna boom-bang-bang with your body, oh We gonna rough it up before we take it slow Girl, let me rock you, rock you like a rodeo It's gonna be a bumpy ride I wanna boom-bang-bang with your body, oh We gonna rough it up before we take it slow Girl, let me rock you, rock you like a rodeo It's gonna be a bumpy ride I wanna boom-bang-bang with your body, oh We gonna rough it up before we take it slow Girl, let me rock you, rock you like a rodeo It's gonna be a bumpy ride I wanna boom-bang-bang with your body, oh We gonna rough it up before we take it slow Girl, let me rock you, rock you like a rodeo It's gonna be a bumpy ride"
1678,Don Omar - Hooka,Don Omar,2010,Hip-Hop/Rap,"['latin hip hop', 'puerto rican pop', 'reggaeton', 'trap latino', 'urbano latino']",latin hip hop,puerto rican pop,reggaeton,390219108,327214,,"[Letra de ""Hooka""] [Intro: Don Omar & Chencho Corleone] ¡Hookah! Plo-plo-plo-plo-plo ¡El Orfanato! Okey, Chencho y Maldy Plan B Pina Records El Rey Don El Rey House of Pleasure [Coro: Don Omar & Chencho Corleone, Ambos] Mari se deja si por el cuello la besan (Jajaja) Como le gusta, se trajo a su media hermana (Eliel) Su media hermana Juana es loca 'e la cabeza Juana baila, fuma, besa, el dembow prende a Mari y Juana (""El Que Habla con Las Manos""; ¡hookah!) Mari se deja si por el cuello la besan Como le gusta, se trajo a su media hermana (El Orfanato) Su media hermana Juana es loca 'e la cabeza Juana baila, fuma, besa, el dembow prende a Mari y Juana [Verso 1: Don Omar & Chencho Corleone, Ambos] Mari y su faldita apretada (So?), anda sola por el flow Bailando encaramá' encima 'e una mesa dembow Me la como solita, mansita, se roba el show Mientra' que el DJ le pone un d-d-d-bow, d-d-bow (D-D-D-D) Gatita calladita, comenzó la función Con eso que hace' rico, cinturita en acción Deja que el ritmo 'el DJ te suba la presión Pa' bajar la tensión date dos cachá' de un blunt (¡Don!) Dale candela, va pa' encima, no se quita Tengo el B12 que su cuerpo necesita Tengo el puré que su boca solicita Me tiene loco, loco, pues la pongo loquita Si arriba la acaricio, abajo se toca solita (Okey) Confieso el vicio que tengo por su faldita (Chencho) Adicto de sus beso', el roce 'e su cinturita Pa' ella soy su cura, ella es mi curita Nos vamo' a fuego donde el cuerpo lo permita Le doy pa'l muro, pa' lo oscuro y se me excita (Jaja) Le doy más duro porque ""¡duro, pa!"" me grita Solo me la corro o lo amerita (Ey) [Coro: Don Omar & Chencho Corleone, Ambos] Mari se deja si por el cuello la besan Como le gusta, se trajo a su media hermana Su media hermana Juana es loca 'e la cabeza Juana baila, fuma, besa, el dembow prende a Mari y Juana (¡Plan B!) Mari se deja si por el cuello la besan (¡Don, Don!) Como le gusta, se trajo a su media hermana (¡Plan B!) Su media hermana Juana es loca 'e la cabeza Juana baila, fuma, besa, el dembow prende a Mari y Juana (D-D-D-D) [Puente: Chencho Corleone & Don Omar] Dale, que el humo le llegue a la cabeza Y que lo combine con cerveza (¡Don!) Juana solita busca su presa Y le seduce con destreza [Verso 2: Maldy & Don Omar] Quiero besarle el cuello, bailar, hacerle el amor Quiero caer en su juego de la seducción Juana se prende en fuego cuando me le pego yo Cuando la acaricio bailando reggaetón (Maldy) Quiero llevarla pa' casa y hacer un threesome En mi cuarto bien loca, en mi cama freedom Un poco 'e whisky, una picky, una zeta de krippy Y darle to' la noche pa' que se levante happy (Don, Don) [Verso 3: Don Omar] Ella es mi mami porque dice: ""Soy su papi"" Yo quiero un cantito de eso' que ella da de gratis Yo quiero ver su cuerpo bailando un slow del DJ Mari me arrebata y ella es to'a guille (¡Plan B!) Y haré una historia en sus Victoria cuando la pille María es pistola, le gusta que la martillen Tienes otra cosa rosa, busca la rastrillen Beben, fuman hierba y al garete viven [Coro: Don Omar & Chencho Corleone, Ambos] Mari se deja si por el cuello la besan Como le gusta, se trajo a su media hermana Su media hermana Juana es loca 'e la cabeza Juana baila, fuma, besa, el dembow prende a Mari y Juana Mari se deja si por el cuello la besan (El Rey) Como le gusta, se trajo a su media hermana (Plan B) Su media hermana Juana es loca 'e la cabeza (Pina Records) Juana baila, fuma, besa, el dembow prende a Mari y Juana [Outro: Don Omar & Chencho Corleone] Tú sabe' 'Tamo matando Eso es así Pina Records Chen-Chen-Chencho, Maldy Don, Don, Don, Don Omar Chencho, Maldy Don Omar Chencho, Maldy El Rey ¡Don, Don! Raphy, me dicen que andan buscando la fórmula Y la tenemos nosotro' Sencillo, ¿no se dan cuenta? D-D-D, D-D-D DJ Eliel, a esta no le van a hacer remix ¡DO! (Jajajaja) ""El Que Habla con Las Manos"" ¿Tú sabe' quién soy yo? Chencho y Maldy El Orfanato, pelagato Jajajajaja"
1677,Justin Bieber - That Should Be Me,Justin Bieber,2010,Pop,"['canadian pop', 'pop']",canadian pop,pop,Unknown,385243951,241123,,"[Verse 1] Everybody's laughin' in my mind Rumours spreadin' 'bout this other guy Do you do what you did when you did with me? Does he love you the way I can? Did you forget all the plans that you made with me? 'Cause, baby, I didn't [Chorus] That should be me holdin' your hand That should be me makin' you laugh That should be me, this is so sad That should be me, that should be me That should be me feelin' your kiss That should be me buyin' you gifts This is so wrong, I can't go on 'Til you believe that that should be me, that should be me [Verse 2] You said you needed a little time for my mistakes It's funny how you used that time to have me replaced Did you think that I wouldn't see you out at the movies? What you doin' to me? You're takin' him where we used to go Now, if you're tryna break my heart, it's working 'cause you know that [Chorus] That should be me holdin' your hand That should be me makin' you laugh That should be me, this is so sad That should be me, that should be me That should be me feelin' your kiss That should be me buyin' you gifts This is so wrong, I can't go on 'Til you believe that that should be me [Bridge] I need to know, should I fight for love or disarm? It's gettin' harder to shield this pain in my heart Oooh [Chorus] That should be me holdin' your hand That should be me makin' you laugh That should be me, this is so sad That should be me, that should be me That should be me feelin' your kiss That should be me buyin' you gifts This is so wrong, I can't go on 'Til you believe that that should be me Holdin' your hand, that should be me The one makin' you laugh oh baby, oh that should be me That should be me givin' you flowers, that should be me talking for hours That should be me, that should be me, that should be me [Outro] Never shoulda let you go, I never shoulda let you go That should be me I'm never gonna let you go That should be me I never shoulda let you go I'm never gonna let you go That should be me I'm never gonna let you go"
1665,David Guetta - Who's That Chick?,David Guetta,2010,Electronic/Dance,"['big room', 'dance pop', 'edm', 'pop', 'pop dance']",big room,dance pop,edm,380954434,266849,,"[Verse 1] Feel the adrenaline movin' under my skin It's an addiction, touch ya, eruption Sound is my remedy, feedin' me energy Music is all I need [Pre-Chorus] Baby, I just wanna dance I don't really care I just wanna dance I don't really care, care, care (You can feel it in the air, yeah) [Chorus] She's been a crazy Dita disco diva and you wonder Who's that chick? Who's that chick? Too cold for you to keep her Too hot for you to leave her Who's that chick? Who's that chick? Who's that chick? Who's that chick? Who's that chick? Who's that chick? [Verse 2] Back on the dance floor, better not to take me home Bass kicking so hard, blazin' through my beating heart French kissin' on the floor, party's getting hardcore Heard everybody's getting a little sexy off the Crazy Juice This will end up on the news [Pre-Chorus] Baby, I just wanna dance I don't really care I just wanna dance I don't really care, care, care (You can feel it in the air, yeah) [Chorus] She's been a crazy Dita disco diva and you wonder Who's that chick? Who's that chick? Too cold for you to keep her Too hot for you to leave her Who's that chick? Who's that chick? Who's that chick? Who's that chick? Who's that chick? Who's that chick? [Bridge] Ultra sexual The night has got me love sprung I won't stop until the sun is up, oh yeah My heart is a dancer, beating like a disco drum (Oh-oh-oh-ooh-oh-oh-oh) Ultra sexual The night has got me love sprung I won't stop until the sun is up, oh yeah My heart is a dancer, beating like a disco drum Beating like a disco drum (Beating like a disco drum) Beating like a disco drum [Chorus] She's been a crazy Dita disco diva and you wonder Who's that chick? Who's that chick? Too cold for you to keep her Too hot for you to leave her Who's that chick? Who's that chick? Who's that chick? Who's that chick? Who's that chick? Who's that chick?"
1697,Don Omar - Taboo,Don Omar,2010,Hip-Hop/Rap,"['latin hip hop', 'puerto rican pop', 'reggaeton', 'trap latino', 'urbano latino']",latin hip hop,puerto rican pop,reggaeton,377971576,293865,,"[Letra de ""Taboo""] [Intro] Bahía azul, A&X (El roce de los cuerpos al ritmo de la música) Taboo (Calor) Amada Brasilia (Pasión) No llores por él (No llores por él) [Pre-Estribillo] Llorando se fue, la que un día me hizo llorar Llorando se fue, la que un día me hizo llorar Llorando estará, recordando el amor que un día no supo cuidar (My lova) Llorando estará, recordando el amor que un día no supo cuidar (Brasil) [Estribillo] A recordação vai estar com ele aonde foi (Vai estar com ele aonde foi) A recordação vai estar pra sempre aonde foi (Vai estar pra sempre aonde foi) Dança, sol e mar, guardarei no olhar O amor vais querer encontrar (Vas a querer, mi amor) Lambando estarei ao lembrar que este amor Por um dia, um instante foi rei (Por um dia, um instante foi rei) [Post-Estribillo] Isso acá é São Paulo, de noche, la luna, las estrellas La playa, la arena, para olvidarme de ella Una sirena que hechiza, y que está tomando el sol, uh-oh-oh-oh Un cuerpo que pida a gritos samba y calor, uh-oh-oh-oh [Refrán] Mi nena, menea, una cintura prendía' en candela Mi nena, menea (Que no se cansa) Mi nena, menea (Bailando así) Mi nena, menea, row the boat, row the boat Mi nena, menea (Matadora) Mi nena, menea [Interludio] Bela de la favela, bela de la favela Bela de la favela Bahía azul, A&X [Pre-Estribillo] Llorando se fue, la que un día me hizo llorar Llorando se fue, la que un día me hizo llorar Llorando estará, recordando el amor que un día no supo cuidar (My lova) Llorando estará, recordando el amor que un día no supo cuidar (Brasil) [Estribillo] A recordação vai estar com ele aonde foi (Vai estar com ele aonde foi) A recordação vai estar pra sempre aonde foi (Vai estar pra sempre aonde foi) Dança, sol e mar, guardarei no olhar O amor vais querer encontrar (Vas a querer, mi amor) Lambando estarei ao lembrar que este amor Por um dia, um instante foi rei (Por um dia, um instante foi rei) [Post-Estribillo] Isso acá é São Paulo, de noche, la luna, las estrellas La playa, la arena para olvidarme de ella Una sirena que hechiza, y que está tomando el sol, uh-oh-oh-oh Un cuerpo que pida a gritos samba y calor, uh-oh-oh-oh [Refrán] Mi nena, menea, una cintura prendía' en candela Mi nena, menea (Que no se cansa) Mi nena, menea (Bailando así) Mi nena, menea, row the boat, row the boat Mi nena, menea (La luna, las estrellas) Mi nena, menea (Taboo) Mi nena, menea (La playa, la arena) Mi nena, menea (Bahía azul, A&X) [Outro] Amada Brasilia No llores por él"
1656,Nicki Minaj - Moment 4 Life,Nicki Minaj,2010,Pop,"['hip pop', 'pop', 'queens hip hop', 'rap']",hip pop,pop,queens hip hop,374438260,121971,,"[Verse 1: Nicki Minaj] I fly with the stars in the skies I am no longer trying to survive I believe that life is a prize But to live doesn't mean you're alive Don't worry 'bout me and who I fire I get what I desire, it's my empire And yes, I call the shots, I am the umpire I sprinkle holy water upon a vampire In this very moment, I'm king In this very moment, I slay Goliath with a sling This very moment, I bring Put it on everything that I will retire with the ring And I will retire with the crown, yes No, I'm not lucky, I'm blessed, yes Clap for the heavyweight champ, me But I couldn't do it all alone, we Young Money raised me, grew up out in Baisley Southside Jamaica, Queens, and it's crazy 'Cause I'm still hood, Hollywood couldn't change me Shout out to my haters, sorry that you couldn't faze me Ain't being cocky, we just vindicated Best believe that when we done, this moment will be syndicated I don't know, this night just remind me of Everything they deprived me of (Yeah) Put your drinks up It's a celebration every time we link up We done did everything they can think of Greatness is what we on the brink of [Chorus: Nicki Minaj] I wish that I could have this moment for life, for life, for life 'Cause in this moment, I just feel so alive, alive, alive I wish that I could have this moment for life, for life, for life This is my moment, I just feel so alive, alive, alive [Verse 2: Drake] What I tell them hoes? Bow, bow, bow to me, drop down to your knees Young Money the mafia, that's word to Lil' Cease I'm in the Dominican, Big Papi Ortiz Doing target practice, all these bitches just aiming to please Shout out to the CEO,  500 Degreez Shout out to the OVO, red wings and fatigues, oh Niggas wanna be friends, how coincidental This supposed to be y'all year? We ain't get the memo A young king, pay me in gold 40 got a bunch of weed he ain't even roll These niggas be droppin' songs, they ain't even cold Weezy on top, and that nigga ain't even home yet Yeah, be very afraid These other rappers gettin' bodied and carried away Fuck it, me and Nicki Nick gettin' married today And all you bitches that be hatin' can catch a bouquet, ooh Yeah, you a star in my eyes You and all them white girls, party of five Are we drinking a lil' more? I can hardly decide I can't believe we really made it, I'm partly surprised, I swear Damn, this one for the books, man I swear this shit is as fun as it looks, man I'm really tryna make it more than what it is 'Cause everybody dies, but not everybody lives, ah [Chorus: Nicki Minaj] I wish that I could have this moment for life, for life, for life 'Cause in this moment, I just feel so alive, alive, alive I wish that I could have this moment for life, for life, for life This is my moment, I just feel so alive, alive, alive [Bridge: Nicki Minaj] This is my moment I waited all my Life, I can tell it's time Drifting away, I'm One with the sunsets I have become alive [Chorus: Nicki Minaj] I wish that I could have this moment for life, for life, for life 'Cause in this moment, I just feel so alive, alive, alive I wish that I could have this moment for life, for life, for life 'Cause in this moment, I just feel so alive, alive, alive"
