Unnamed: 0,Artist and Title,Artist,Year,main_genre,genres,first_genre,second_genre,third_genre,Streams,Daily,Title,lyrics
1753,Cosculluela - Prrrum,Cosculluela,2010,Hip-Hop/Rap,"['latin hip hop', 'reggaeton', 'trap latino', 'urbano latino']",latin hip hop,reggaeton,trap latino,216081735,112094,,"[Letra de ""Prrrum""] [Intro] Mami, yo te he visto Tú llegas a la disco junto a él Yo no me resisto Tú bailas y la disco se quiere romper Mami, yo te robo Ph-uh-oh, y no pasa na' Tú novio es un bobo Oh-uh-oh, él no va a hacer na' [Coro] Prrrum, si lo pillo por la calle dice, prrrum Si lo pillo por la disco dice, prrrum (Oh, no) Si lo pillo por el área dice, prrrum, prrrum, prrrum, prrrum Prrrum, si lo pillo por la calle dice, prrrum Si lo pillo por la disco dice, prrrum Si lo pillo por el área dice, prrrum, prrrum, prrrum, prrrum [Verso 1] El jefe de la tribu, desde que nos subieron el IVU (Oh) El novio tuyo está comprando Reebok (Jajajaja) No sé pique-pique, es Dracula Boy, el de los tickets (Tranquila) Tú eres mi girly-girl, baby, así que (Muah) Te quiero en un frasco, pídeme que yo te complazco Dicen que estoy loco del casco (Auh) Lo-lo-loco crazy, exploto las tarjetas en Macy's (Tu sabe') Tengo la Thompson como Dick Tracy Pa'l gato tuyo [Pre-Coro] Ra-pa-pa-pa-pai', no se ponga bruto Tú sabes cómo brego, tú sabes que no juego, na', na' (Ah-auh) Ra-pa-pa-pa-pai, pa-pau, no te pongas bruto (No te pongas bruto, boy) Tú sabes cómo brego, tú sabes que no juego, na', na'' [Coro] Prrrum, si lo pillo por la calle dice, prrrum Si lo pillo por la disco dice, prrrum Si lo pillo por el área dice, prrrum, prrrum, prrrum, prrrum (You know) Prrrum, si lo pillo por la calle dice, prrrum Si lo pillo por la disco dice, prrrum Si lo pillo por el área dice, prrrum, prrrum, prrrum, prrrum [Verso 2] Está fronteando con la Hummer El guaynabito, pero sigo under Duro en la calle sin darle a los dumbbells (Aja) Mi nombre sí que pesa, yo soy El Princi y tú la princesa Y el gato tuyo Pata lo endereza (¡Pata!) Le metemos bueno y sano, mami, te los pillo entre Shannan's Y el party se le va a acabar temprano Tú sabes como soy contigo, así que suave conmigo Mami, se pone bruto la saco y te lo fumigo, oh [Pre-Coro] Ra-pa-pa-pa-pai', no se ponga bruto Tú sabes cómo brego, tú sabes que no juego, na', na' Ra-pa-pa-pa-pai, pa-pau, no te pongas bruto (No te pongas bruto) Tú sabes cómo brego, tú sabes que no juego, na', na'' [Coro] Prrrum, si lo pillo por la calle dice, prrrum Si lo pillo por la disco dice, prrrum Si lo pillo por el área dice, prrrum, prrrum, prrrum, prrrum Prrrum, si lo pillo por la calle dice, prrrum Si lo pillo por la disco dice, prrrum Si lo pillo por el área dice, prrrum, prrrum, prrrum, prrrum [Outro] It's the Rottweilas Inc, baby, jajajaja Yo' Jaime El Cerebro, El Mueka DJ Blass, El Artesano Echo The Lab La verdadera y única arma secreta, Lele, jaja Ah, a mí no me escriben las canciones, eso e' a ustede', jajajaja It's the White Lion, baby Tú sabes que nosotros somos los mejores, bro Prrrum, you know me, ¡El Princi!, jajajaja"
1783,Camila - Bésame,Camila,2010,Pop,"['dance pop', 'pop']",dance pop,pop,Unknown,215472394,109368,,"[Letra de ""Bésame""] [Verso 1] Bésame a destiempo Sin piedad y en silencio Bésame, frena el tiempo Haz crecer lo que siento [Coro] Bésame como si el mundo se acabara después Bésame, y beso a beso pon el cielo al revés Bésame sin razón porque quiere el corazón Bésame [Interludio] Uh-uh-uh-uh Oh, oh-oh-oh [Verso 2] Siénteme en el viento Mientras yo muero lento Bésame sin motivos Y esta vez siempre contigo, oh, oh, uh-uh [Coro] Bésame como si el mundo se acabara después (Yeah) Bésame, y beso a beso pon el cielo al revés (Uh-uh, woah) Bésame sin razón porque quiere el corazón Bésame [Interludio] Uh-uh, oh-oh Uh-uh, woah, woah, woah Uh-uh-uh-uh-uh Bésame [Coro] Bésame como si el mundo se acabara después (Yeah) Bésame, y beso a beso pon el cielo al revés (Uh-uh, woah) Bésame sin razón porque quiere el corazón Bésame [Outro] Bésame así, sin compasión Quédate en mí sin condición Dame tan solo un motivo Y me quedo yo Y me quedo yo Y me quedo yo Y me quedo yo"
1553,Miguel - Sure Thing,Miguel,2010,R&B/Soul,"['r&b', 'urban contemporary']",r&b,urban contemporary,Unknown,213904347,37067,,"[Intro] Love you like a brother Treat you like a friend Respect you like a lover [Refrain] Oh-ooh-oh, oh-ooh-oh, oh-ooh-oh (You could bet that, never gotta sweat that ) Oh-ooh-oh, oh-ooh-oh, oh ( You could bet that, never gotta sweat that ) Yeah, yeah, yeah ( You could bet that, never gotta sweat that ) ( You could  bet  that, never gotta sweat that ) Yeah [Verse 1] If you be the cash, I'll be the rubber band You be the match, I will be a fuse, boom! Painter, baby, you could be the muse I'm the reporter, baby, you could be the news 'Cause you're the cigarette and I'm the smoker We raise a bet 'cause you're the joker Checked off, you are the chalk And I could be the blackboard, you can be the talk And I can be the walk, yeah-eah [Chorus] Even when the sky comes fallin' Even when the sun don't shine I got faith in you and I So put your pretty little hand in mine Even when we're down to the wire, babe Even when it's do or die We could do it, baby, simple and plain 'Cause this love is a sure thing, yeah [Refrain] (You could bet that, never gotta sweat that) Oh yeah, yeah (You could bet that, never gotta sweat that) (You could bet that, never gotta sweat that) (You could bet that, never gotta sweat that) [Verse 2] You could be the lover, I'd be the fighter, babe If I'm the blunt (Uh), you could be the lighter, babe, fire it up! Writer, baby, you could be the quote, yeah (Uh) If I'm the lyric, baby, you could be the note (Uh), record that! Saint, I'm a sinner, prize, I'm a winner And it's you, what did I do to deserve that? Paper, baby, I'll be the pen Say that I'm the one 'cause you are a ten Real and not pretend [Chorus] Even when the sky comes fallin' (Yeah, yeah, yeah, yeah, yeah, yeah) Even when the sun don't shine I got faith in you and I So put your pretty little hand in mine (You could bet that, never gotta sweat that) Even when we're down to the wire, babe (You could bet that, never gotta sweat that) Even when it's do or die (You could bet that, never gotta sweat that) We could do it, baby, simple and plain (You could bet that, never gotta sweat that) 'Cause this love is a sure thing, yeah [Bridge] Uh, now rock with me, babe And let me hold you in my arms, talk with me, babe, yeah-yeah Uh, now rock with me, babe And let me hold you in my arms, talk with me, babe, yeah-yeah This love between you and I is simple as pie, baby It's such a sure thing, it's such a sure thing Oh, it's such a sure thing, yeah, yeah, yeah, yeah (It's such a sure thing) [Chorus] (You could bet that, never gotta sweat that) Even when the sky comes fallin' (Yeah) (You could bet that, never gotta sweat that) Even when the sun don't shine (You could bet that, never gotta sweat that) I got faith in you and I (You could bet that, never gotta sweat that) So put your pretty little hand in mine (You could bet that, never gotta sweat that) Even when we're down to the wire, babe (You could bet that, never gotta sweat that) Even when it's do or die (You could bet that, never gotta sweat that) We could do it, baby, simple and plain (You could bet that, never gotta sweat that) 'Cause this love is a sure thing [Outro] (You could bet that, never gotta sweat that) Love you like a brother (You could bet that, never gotta sweat that) Treat you like a friend (You could bet that, never gotta sweat that) Respect you like a lover (You could bet that, never gotta sweat that) Oh-ooh-oh, oh-ooh-oh, oh-ooh-oh"
1735,Arcade Fire - The Suburbs,Arcade Fire,2010,Rock,"['alternative rock', 'baroque pop', 'canadian indie', 'canadian indie rock', 'chamber pop', 'indie rock', 'indietronica', 'modern rock', 'permanent wave', 'quebec indie', 'rock']",alternative rock,baroque pop,canadian indie,211035035,61643,,"[Verse 1] In the suburbs, I I learned to drive And you told me we'd never survive Grab your mother's keys, we're leaving You always seemed so sure That one day we'd be fighting in a suburban war Your part of town against mine I saw you standing on the opposite shore But by the time the first bombs fell We were already bored We were already, already bored [Chorus] Sometimes I can't believe it I'm moving past the feeling Sometimes I can't believe it I'm moving past the feeling again [Verse 2] The kids want to be so hard But in my dreams, we're still screaming And running through the yard And all of the walls that they built in the seventies finally fall And all of the houses they built in the seventies finally fall Meant nothing at all Meant nothing at all, it meant nothing [Chorus] Sometimes I can't believe it I'm moving past the feeling Sometimes I can't believe it I'm moving past the feeling and into the night [Verse 3] So can you understand That I want a daughter while I'm still young? I want to hold her hand And show her some beauty before this damage is done But if it's too much to ask, if it's too much to ask Then send me a son Under the overpass In the parking lot, we're still waiting, it's already passed So move your feet from hot pavement and into the grass 'Cause it's already passed It's already, already passed [Chorus] Sometimes I can't believe it I'm moving past the feeling Sometimes I can't believe it I'm moving past the feeling again I'm moving past the feeling I'm moving past the feeling [Outro] In my dreams, we're still screaming We're still screaming We're still screaming"
1729,Blake Shelton - Honey Bee,Blake Shelton,2010,World/Traditional,"['classic oklahoma country', 'contemporary country', 'country', 'country road', 'modern country rock']",classic oklahoma country,contemporary country,country,210258931,54242,,"[Verse 1] Girl, I've been thinking 'bout us And you know I ain't good at this stuff These feelings pilin' up won't give me no rest This might come out a little crazy A little sideways, yeah, maybe I don't know how long it'll take me, but I'll do my best [Chorus 1] If you'll be my soft and sweet I'll be your strong and steady You be my glass of wine I'll be your shot of whiskey You be my sunny day I'll be your shade tree You be my honeysuckle I'll be your honey bee [Verse 2] Yeah, that came out a little country But every word was right on the money And I got you smilin', honey, right back at me Now hold on 'cause I ain't done There's more where that came from Well, you know I'm just havin' fun, but seriously [Chorus 2] If you'll be my Louisiana I'll be your Mississippi You be my Little Loretta I'll be your Conway Twitty You be my sugar, baby I'll be your sweet iced tea You be my honeysuckle I'll be your honey bee [Verse 3] Your kiss just said it all I'm glad we had this talk Nothing left to do but fall in each other's arms I coulda said, ""I love you"" Coulda wrote you a line or two Baby, all I know to do is speak right from the heart [Chorus 1] If you'll be my soft and sweet I'll be your strong and steady You be my glass of wine I'll be your shot of whiskey You be my sunny day I'll be your shade tree You be my honeysuckle I'll be your honey bee [Chorus 2] You be my Louisiana I'll be your Mississippi You be my Little Loretta I'll be your Conway Twitty You be my sugar, baby I'll be your sweet iced tea You be my honeysuckle And I'll be your honey bee [Outro] I'll be your honey bee"
1749,ONE OK ROCK - Wherever you are,ONE OK ROCK,2010,Pop,"['j-pop', 'j-rock']",j-pop,j-rock,Unknown,209538348,89800,,"[Verse 1] I'm telling you, oh yeah I softly whisper Tonight, tonight You are my angel Aishiteru yo, oh yeah Futari wa hitotsu ni Tonight, tonight I just say [Chorus] Wherever you are, I'll always make you smile Wherever you are, I'm always by your side Whatever you say, kimi wo omou kimochi I promise you forever right now [Verse 2] I don't need a reason I just want you baby Alright alright Day after day Kono saki nagai koto zutto Douka konna boku to zutto Shinu made stay with me We carry on [Chorus] Wherever you are, I'll always make you smile Wherever you are, I'm always by your side Whatever you say, kimi wo omou kimochi I promise you forever right now Wherever you are, I'll never make you cry Wherever you are, I'll never say goodbye Whatever you say, kimi wo omou kimochi I promise you forever right now [Bridge] Bokura ga deatta hi wa Futari ni totte ichiban me no kinen no subeki hi da ne Soshite kyou to iu hi wa Futari ni totte niban me no kinen no subeki hi da ne [Chorus] Kokoro kara aiseru hito Kokoro kara itoshii hito Kono boku no ai no mannaka ni wa Itsumo kimi ga iru kara Wherever you are, I'll always make you smile Wherever you are, I'm always by your side Whatever you say, kimi wo omou kimochi I promise you forever right now Wherever you are Wherever you are Wherever you are"
1733,Ludacris - My Chick Bad,Ludacris,2010,Hip-Hop/Rap,"['atl hip hop', 'dance pop', 'dirty south rap', 'hip hop', 'old school atlanta hip hop', 'pop rap', 'rap', 'southern hip hop', 'trap']",atl hip hop,dance pop,dirty south rap,209088224,50731,,"[Chorus] My chick bad, my chick hood My chick do stuff that your chick wish she could My-my chick bad, my chick hood My chick do stuff that your chick wish she could (DTP!) My-my chick bad, badder-badder than yours My-my chick bad, badder-badder than yours My-my-my chick bad, badder-badder than yours My-my chick bad, badder-badder than yours [Verse 1: Ludacris] Listen, I'm sayin' my chick bad, my chick hood My chick do stuff that your chick wish she could My chick bad, badder than yours My chick do stuff that I can't even put in words Her swagger don't stop, her body won't quit So fool pipe down, you ain't talkin 'bout shit M-m-my chick bad, tell me if you seen her She always bring the racket like Venus and Serena All white top, all white belt And all white jeans, body lookin' like milk No-no time for games, she's full grown My chick bad, tell yo' chick to go home [Chorus] My chick bad, my chick hood My chick do stuff that your chick wish she could My-my chick bad, my chick hood My chick do stuff that your chick wish she could (Let's go!) My-my chick bad, badder-badder than yours My-my chick bad, badder-badder than yours My-my-my chick bad, badder-badder than yours My-my chick bad, badder-badder than yours [Verse 2: Ludacris] Now-now-now-now-now-now, now your girl might be sick but my girl's sicker She rides that dick and she handles her liquor Will knock a bitch out, annnnd fight Comin' out swingin' like Tiger Woods' wife Yeahhh, she could get a little hasty Chicks better cover up they chest like pasties Couple girlfriends and they ALL a little crazy Comin down the street like a parade, Macy's (Whoo!) I fill 'er up, balloons Test her and guns get drawn like cartoons D'oh, but I ain't talkin 'bout Homer Chick's so bad the whole crew wanna bone her, yeah [Chorus] My chick bad, my chick hood My chick do stuff that your chick wish she could My-my chick bad (and I'm lovin' it!), my chick hood My chick do stuff that your chick wish she could My-my chick bad, badder-badder than yours My-my chick bad, badder-badder than yours My-my-my chick bad, badder-badder than yours My-my chick bad, badder-badder than yours [Verse 3: Nicki Minaj] Yo, yo, now-now-now-now Now all these bitches wanna try and be my bestie But I take a left and leave them hangin' like a testie Trash talk to 'em then I put 'em in a Hefty Runnin' down the court I'm dunkin' on 'em, Lisa Leslie It-it-it-it-it's goin' down, basement Friday the 13th, guess who's playing Jason Tuck yourself in, you better hold onto your teddy It's Nightmare on Elm Street and guess who's playin' Freddy My chick bad, chef cookin' for me They say my shoe game crazy, the mental asylum lookin' for me (Ha ha ha ha), you a rookie to me I'm in that wham-bam purple Lam, damn bitch you been a fan [Chorus] My chick bad (don't get scared now, haha!), my chick hood My chick do stuff that your chick wish she could (Disturbing Tha Peace!) My-my chick bad, my chick hood My chick do stuff that your chick wish she could My-my chick bad, badder-badder than yours My-my chick bad, badder-badder than yours My-my-my chick bad, badder-badder than yours My-my chick bad, badder-badder than yours [Outro: Ludacris] Luda, DTP And when we all alone, I might just tip her She slides down the pole, like a certified stripper When we all alone I might tip, tip her She slides down the pole, like a certified stripper When-when we all alone, I might just tip her She slides down the pole, like a certified stripper When we all alone, I might just tip her She slides down the pole, like a certified stripper, I kinda like that"
1757,Loona - Vamos a la Playa,Loona,2010,Pop,"['k-pop', 'k-pop girl group']",k-pop,k-pop girl group,Unknown,208779193,68631,,"[Chorus] Let's go to the beach, I like dancing The rhythm of the night, sounds of the party Let's go to the beach, I like dancing The rhythm of the night, sounds of the party [Refrain] You know we go where the feelin' is right You know we go where the groove is hot You know we go where the feelin' is right, feelin' is right, feelin' is right [Chorus] Let's go to the beach, I like dancing The rhythm of the night, sounds of the party Let's go to the beach, I like dancing The rhythm of the night, sounds of the party [Verse] Friends, what a heat! This machine dancing Let's all go to the beach, let's all go partying Dance, dance (Wouh) Dance, dance (Wouh) Dance, dance (Wouh) [Refrain] You know we go where the feelin' is right You know we go where the groove is hot You know we go where the feelin' is right, feelin' is right, feelin' is right [Chorus] Let's go to the beach, I like dancing The rhythm of the night, sounds of the party Let's go to the beach, I like dancing The rhythm of the night, sounds of the party Let's go to the beach, I like dancing The rhythm of the night, sounds of the party Let's go to the beach, I like dancing The rhythm of the night, sounds of the party [Verse] Friends, what a heat! This machine dancing Let's all go to the beach, let's all go partying Dance, dance Dance, dance Dance, dance [Refrain] You know we go where the feelin' is right You know we go where the groove is hot You know we go where the feelin' is right, feelin' is right, feelin' is right [Chorus] Let's go to the beach, I like dancing The rhythm of the night, sounds of the party Let's go to the beach, I like dancing The rhythm of the night, sounds of the party Let's go to the beach, I like dancing The rhythm of the night, sounds of the party Let's go to the beach, I like dancing The rhythm of the night, sounds of the party"
1746,Big Time Rush - Boyfriend,Big Time Rush,2010,Pop,"['boy band', 'pop', 'post-teen pop']",boy band,pop,post-teen pop,208701750,90750,,"[Chorus: All] Your boy, boy, bo-bo-boy, bo-bo-boyfriend Your boy, boy, bo-bo-boy, bo-bo-boyfriend Your boy, boy, bo-bo-boy, bo-bo-boyfriend Your boy, boy, bo-bo-boy, bo-bo-boy [Verse 1: Kendall Schmidt & James Maslow] Have you ever had the feeling you're drawn to someone, yeah And it isn't anything they could've said or done? (Oh-oh-oh-oh) And every day I see you on your own and I can't believe that you're alone (Alone) But I overheard your girls and this is what they said [Pre-Chorus: Kendall Schmidt] Looking for a, looking for a That you're looking for a boyfriend (Hey!), I see that (See that) Give me time, you know, I'm gonna be there (Be there) Don't be scared to come, put your trust in me Can't you see all I really wanna be Is your boyfriend? (Hey!), can't fight that (Fight that) Knock me down, you know, I'm coming right back (Right back) I don't care at all what you done before All I really want is to be your (Be your) [Chorus: All] Your boy, boy, bo-bo-boy, bo-bo-boyfriend (Hey!) Your boy, boy, bo-bo-boy, bo-bo-boyfriend Your boy, boy, bo-bo-boy, bo-bo-boyfriend (Hey!) Your boy, boy, bo-bo-boy, bo-bo-boyfriend [Verse 2: James Maslow & Kendall Schmidt] Let me take a little moment to find the right words (To find the right words) So when I kick it to you it ain't something that you've heard (Something that you heard) I don't know what kind of guy that you prefer But I know I gotta put myself for worse See I think I got the kind of love that you deserve and I heard that [Pre-Chorus: Kendall Schmidt] That you're looking for a boyfriend (Boyfriend), I see that (See that) Give me time, you know, I'm gonna be there (Be there) Don't be scared to come, put your trust in me Can't you see all I really wanna be Is your boyfriend? (Hey!), can't fight that (Fight that) Knock me down, you know, I'm coming right back (Right back) I don't care at all what you done before All I really want is to be your (Be your) [Chorus: All] Your boy, boy, bo-bo-boy, bo-bo-boyfriend (Hey!) Your boy, boy, bo-bo-boy, bo-bo-boyfriend Your boy, boy, bo-bo-boy, bo-bo-boyfriend Your boy, boy, bo-bo-boy, bo-bo-boyfriend [Bridge: Carlos Pena Jr.] If you tell me where, I'm waiting here Every day like Slumdog Millionaire Bigger than the Twilight love affair I'll be here, girl, I swear [Pre-Chorus: Kendall Schmidt & Logan Henderson] Looking for a, looking for a That you're looking for a boyfriend (Hey!), I see that (See that) Give me time, you know, I'm gonna be there (Be there) Don't be scared to come, put your trust in me Can't you see all I really want to be Is your boyfriend? (Hey!), can't fight that (Fight that) Knock me down, you know, I'm coming right back (Right back) I don't care at all what you done before All I really want is to be your (Be your; be your) [Chorus: Logan Henderson, All] Your boy, boy, bo-bo-boy, bo-bo-boyfriend Your boy, boy, bo-bo-boy, bo-bo-boyfriend (Your boyfriend) Your boy, boy, bo-bo-boy, bo-bo-boyfriend (Your boyfriend) Your boy, boy, bo-bo-boy, bo-bo-boyfriend All I really want is to be your (Be your boyfriend; be your) Your boy, boy, bo-bo-boy, bo-bo-boyfriend (Uh, uh-uh) Your boy, boy, bo-bo-boy, bo-bo-boyfriend (Ye-ye-yeah) Your boy, boy, bo-bo-boy, bo-bo-boyfriend (Hey!) Your boy, boy, bo-bo-boy, bo-bo-boyfriend All I really want is to be your (Be your; be your) [Outro: All] Your boy, boy, bo-bo-boy, bo-bo-boyfriend Your boy, boy, bo-bo-boy, bo-bo-boyfriend (Hey!) Your boy, boy, bo-bo-boy, bo-bo-boyfriend All I really want is to be your"
