Unnamed: 0,Artist and Title,Artist,Year,main_genre,genres,first_genre,second_genre,third_genre,Streams,Daily,Title,lyrics
2834,Taio Cruz - Hangover,Taio Cruz,2011,Pop,"['dance pop', 'pop', 'pop rap']",dance pop,pop,pop rap,480179453,173537,,"[Chorus: Taio Cruz] I got a hangover, woah I been drinkin' too much for sure I got a hangover, woah I got an empty cup, pour me some more So I can go until I blow up, eh And I can drink until I throw up, eh And I don't ever, ever want to grow up, eh I wanna keep it goin', k-keep, keep it goin' [Drop: Taio Cruz] Yeah (Oh) (Oh) [Verse 1: Taio Cruz] I got a little bit trashed last night, night I got a little bit wasted (Yeah, yeah) I got a little bit mashed last night, night I got a little shit-faceted (Yeah, yeah) [Pre-Chorus: Taio Cruz] Well (Oh) I'm gonna roll If you don't know Well, now you know [Chorus: Taio Cruz] I got a hangover, woah I been drinkin' too much for sure I got a hangover, woah I got an empty cup, pour me some more So I can go until I blow up, eh And I can drink until I throw up, eh And I don't ever, ever want to grow up, eh I wanna keep it goin', k-keep, keep it goin', come on [Drop: Taio Cruz] Yeah (Oh) (Oh) [Verse 2: Flo Rida] Drink up, 'cause a party ain't a party 'til you ride on through it End up on the floor, you can't remember, you clueless Officer like, ""What the hell is you doin'?"" Stumblin', fumblin', you wanna what? Come again? Gimme Henn, gimme gin, gimme liquor Gimme champagne bubbles 'til I'm bent What happens after that? If you inspired, tell a friend Like, ""Oh, my homie, Taio, we can all sip again,"" get it in And again and again, leave evidence Wasted, so what? Irrelevant Beer keg to the head, who's sellin' it? I got a hangover, that's my medicine Don't mean to brag or sound too intelligent A little Jack can't hurt this veteran I show up, but I never throw up So let the drinks go up, pour up [Chorus: Taio Cruz] I got a hangover, woah I been drinkin' too much for sure I got a hangover, woah I got an empty cup, pour me some more So I can go until I blow up, eh And I can drink until I throw up, eh And I don't ever, ever want to grow up, eh I wanna keep it goin', k-keep, keep it goin', come on Come on Come on [Drop: Taio Cruz] I got a hangover, woah I been drinkin' too much for sure I got a hangover, woah I got an empty cup, pour me some more So I can go until I blow up, eh And I can drink until I throw up, eh And I don't ever, ever want to grow up, eh I wanna keep it goin', k-keep, keep it goin', come on"
2825,Mac Miller - Donald Trump,Mac Miller,2011,Hip-Hop/Rap,"['hip hop', 'pittsburgh rap', 'rap']",hip hop,pittsburgh rap,rap,478676746,81927,,"[Intro] Hey Ayo, Sap, what's good, bruh? This man's kinda high out here [Verse 1] Ayo, the flyest ma'fucker in the room, yeah, you know it's me Bitches hatin' on him 'cause he started out here locally Hopefully, I'll be at the top soon For now, I'm at my house on the couch watchin' cartoons You know how much you love it when you get it in abundance Give a fuck about a budget when you always be the subject of discussion But it's nothin' when you stop and just say, ""fuck it"" 'Cause you walkin' out in public and you hear 'em talkin' rubbish I just wanna ride, ride through the city in a Cutlass Find a big butt bitch somewhere, get my nuts kissed That's the way it goes when you party just like I do Bitches on my dick that used to brush me off in high school [Chorus] Take over the world when I'm on my Donald Trump shit Look at all this money, ain't that some shit? Take over the world when I'm on my Donald Trump shit Look at all this money, ain't that some shit? (Hey) We gon' take over the world while these haters gettin' mad That's why all my bitches bad, they see this crazy life I have And they in awe, we gon' win, you can take the lose or draw What I'm in got these hoes who used to play me in they bras We gon' take over the world while these haters gettin' mad Take over the world, watch these haters get mad That's why all my bitches bad, they see this crazy life I have Hop into the car and then we take 'em to the pad, it's a wrap [Verse 2] Uh, uh, uh And ma'fuckers think they know me, but they never met the kid Style come with excellence and money make benevolence Irrelevant for the fuckers who never been intelligent I kill my Henny, break the bottle for the hell of it Tell a bitch that she better bring her friends And if she want an autograph she better bring a pen Yeah, the party never end, this life is what I recommend And if you got a ho picked for me, then she better be a 10 I ain't picky, but these girls be actin' tricky When the situation's sticky and the liquor got 'em silly [Chorus] But I take over the world when I'm on my Donald Trump shit Look at all this money, ain't that some shit? We gon' take over the world while these haters gettin' mad That's why all my bitches bad, they see this crazy life I have And they in awe, we gon' win, you can take the lose or draw What I'm in got these hoes who used to play me in they bras We gon' take over the world while these haters gettin' mad Take over the world, watch these haters get mad That's why all my bitches bad, they see this crazy life I have Hop into the car and then we take 'em to the pad, it's a wrap"
2841,Scorpions - Still Loving You,Scorpions,2011,Rock,"['album rock', 'german hard rock', 'german metal', 'german rock', 'hard rock', 'rock']",album rock,german hard rock,german metal,478644717,378783,,"[Verse 1] Time, it needs time To win back your love again I will be there, I will be there Love, only love Can bring back your love someday I will be there, I will be there [Verse 2] Fight, babe, I'll fight To win back your love again I will be there, I will be there Love, only love Can break down the wall someday I will be there, I will be there [Chorus] If we'd go again All the way from the start I would try to change The things that killed our love Your pride has built a wall So strong, that I can't get through Is there really no chance To start once again? I'm loving you [Verse 3] Try, baby, try To trust in my love again I will be there, I will be there Love, our love Just shouldn't be thrown away I will be there, I will be there [Chorus] If we'd go again All the way from the start I would try to change The things that killed our love Your pride has built a wall So strong, that I can't get through Is there really no chance To start once again? If we'd go again All the way from the start I would try to change The things that killed our love Yes, I've hurt your pride And I know what you've been through You should give me a chance This can't be the end [Outro] I'm still loving you I'm still loving you I'm still loving you I need your love I'm still loving you Still loving you, baby, woo I'm still loving you I need your love I'm still loving you I need your love, woo I'm still loving you I need your love, woo I need your love I need your love"
2843,The Drums - Money,The Drums,2011,Indie/Alternative,"['brooklyn indie', 'indie surf']",brooklyn indie,indie surf,Unknown,477518550,250575,,"[Verse 1] Before I die, I'd like to do something nice Take my hand, and I'll take you for a ride You hit me yesterday because I made you cry So before we die, I'd like to do something nice [Chorus] I want to buy you something But I don't have any money No, I don't have any money I want to buy you something But I don't have any money No, I don't have any money [Verse 2] And if I had a car, I would trade in my car If I had a gun, I would trade in my gun Honey, we ran from the country when we rushed to the city And now there's nothin' to be done, there's nothin' to be done There's nothin' to be done, there's nothin' to be done [Chorus] I want to buy you somethin' But I don't have any money No, I don't have any money I want to buy you somethin' But I don't have any money No, I don't have any money [Post-Chorus] Ha ahh, ohh oh-oh Ha ahh, ohh oh-oh Ha ahh, ohh oh-oh Ha ahh, ohh oh-oh Ha ahh, ohh oh-oh (Ha!) Ha ahh, ohh oh-oh (Ha!) Ha ahh, ohh oh-oh (Ha!) Ha ahh, ohh oh-oh oh-oh-oh-oh [Instrumental Break] [Chorus] I want to buy you somethin' But I don't have any money No, I don't have any money I want to buy you somethin' But I don't have any money No, I don't have any money And I wanna buy you somethin' But I don't have any money No, I don't have any money And I want to buy you somethin' But I don't have any money No, I don't have any money [Post-Chorus] Ha ahh, ohh oh-oh Ha ahh, ohh oh-oh Ha ahh, ohh oh-oh Ha ahh, ohh oh-oh Ha ahh, ohh oh-oh (Ha!) Ha ahh, ohh oh-oh (Ha!) Ha ahh, ohh oh-oh (Ha!) Ha ahh, ohh oh-oh [Outro] Ha ahh, ohh oh-oh (Any money) Ha ahh, ohh oh-oh (Any money) Ha ahh, ohh oh-oh (Any money) Ha ahh, ohh oh-oh (Any money) Ha ahh, ohh oh-oh (Any money) Ha ahh, ohh oh-oh (Any money) Ha ahh, ohh oh-oh (Any money) Ha ahh, ohh oh-oh oh-oh-oh-oh (Any money)"
2837,M83 - Wait,M83,2011,Electronic/Dance,"['french shoegaze', 'french synthpop', 'indietronica', 'metropopolis', 'neo-synthpop']",french shoegaze,french synthpop,indietronica,473020430,160678,,[Verse 1] Send your dreams Where nobody hides Give your tears To the tide [Chorus] No time No time [Verse 2] There's no end There is no goodbye Disappear With the night [Chorus] No time No time No time No time No time
2853,Rihanna - You Da One,Rihanna,2011,Pop,"['barbadian pop', 'pop', 'urban contemporary']",barbadian pop,pop,urban contemporary,468293702,507385,,"[Intro] You the one that I dream about all day You the one that I think about always You are the one, so I make sure I'll behave My love is your love, your love is my love, love, love [Verse 1] Baby, I love you I need you here with me all the time Baby, we meant to be You got me smiling all the time [Pre-Chorus] 'Cause you know how to give me that You know how to pull me back when I go runnin', runnin' Tryna get away from loving ya You know how to love me hard I won't lie, I'm falling hard Yep, I'm falling for ya, but there's nothin' wrong with that [Chorus] You the one that I dream about all day You the one that I think about always You are the one, so I make sure I'll behave My love is your love, your love is my love You the one that I dream about all day You the one that I think about always You are the one, so I make sure I'll behave My love is your love, your love is mine [Verse 2] Baby come, take me now Hold me now, make me come alive You got the sweetest touch I'm so happy you came in my life [Pre-Chorus] 'Cause you know how to give me that You know how to pull me back when I go runnin', runnin' Tryna get away from loving ya You know how to love me hard I won't lie, I'm falling hard Yep, I'm falling for ya but there's nothin' wrong with that [Chorus] You the one that I dream about all day You the one that I think about always You are the one, so I make sure I'll behave (You the one) My love is your love, your love is my love You the one that I dream about all day (You are the one) You the one that I think about always (So you're the one) You are the one, so I make sure I'll behave My love is your love, your love is mine [Bridge] And yes, I'm kinda crazy That's what happens, baby When you put it down You shouldn't give it to me good like that Shouldn't hit it like that Had me yellin' like that Didn't know you would've had me coming back You the one that I'm feelin' You the one that I'm lovin' Ain't no other niggas like you No, there's just one, one, one, o-o-one No, baby, just one, one, o-one I bet you wanna know [Chorus] You the one that I dream about all day You the one that I think about always You are the one, so I make sure I'll behave My love is your love, your love is my love (Your love is mine) You the one that I dream about all day (You are the one) You the one that I think about always (You are the one) You are the one, so I make sure I'll behave My love is your love, your love is mine"
2833,Childish Gambino - Bonfire,Childish Gambino,2011,Hip-Hop/Rap,"['atl hip hop', 'hip hop', 'rap']",atl hip hop,hip hop,rap,462648452,118430,,"[Verse 1] Okay, it's Childish Gambino, homegirl drop it like the NASDAQ Move white girls like there's coke up my asscrack Move Black girls 'cause, man, fuck it, I'll do either I love pussy, I love bitches, dude, I should be runnin’ PETA In Adidas, with some short shorts, B-O-O all over me My green is where it's supposed to be, your green is in my grocery This Asian dude, I stole his girl, and now he got that Kogi beef My dick is like an accent mark, it's all about the over E's Hot like a parked car I sound weird like ""nigga"" with a hard 'R' Fly like the logo on my cousin's 440 Eatin' Oreos like these white girls that blow me Vodka for my ladies, whiskey for a grown man Hangin' in the islands, lookin' for Earl like Toejam I made the beat retarded, so I'm callin' it a slow jam Butcher and I know it, man, kill beef, go ham These rappers are afraid of him 'Cause I'm a beast, bitch, ""grrr"",  Invader Zim Gambino is a call girl, fuck you, pay me Brand new whip for these niggas like slavery Told me I was awful and that shit did not faze me Tell me how I suck again, my memory is hazy “You're my favorite rapper now”, yeah, dude, I better be Or you can fuckin' kiss my ass,  Human Centipede You wanna see my girl? I ain't that dumb You wanna see my girl? Check  Maxim ""Man, why does every black actor gotta rap some?” I don't know, all I know is I'm the best one [Chorus] It's a bonfire, turn the lights out I'm burnin' everything you mothafuckas talk about It's a bonfire, turn the lights out I'm burnin' everything you mothafuckas talk about [Verse 2] You know these rapper dudes talk shit, start killin' Fuck that, got goons like an archvillain I'm from the South, ain't got no accent, don't know why So this rap is child's play, I do my name like Princess Di Yeah, they say they want the realness, rap about my real life Told me I should just quit, ""First of all, you talk white Second off, you talk like you haven't given up yet"" Rap's stepfather, yeah, you hate me but you will respect I put in work, ask Ludwig Put my soul on the track like shoes did Played this for my cousin, now he can't even think straight Black and white music? Now, nigga, that's a mixtape Shout out to my blerds, they represent the realness Shout out to Gambino Girls, my dick is in the building I know you hate me 'cause your little cousin play me out I like Black girls who nerdy but when they dance they be sayin' ""Ow"" I'm sorry for who followed me Chillin' with a Filipina at your local Jollibee Yeah, I'm in her ass like sodomy So if you see my hand under the table, don't bother me I don't talk soft, that's that other guy I'm screamin' ""What the fuck is up?"" like I ain't seen the sky The shit I'm doin' this year? Insanity Made the beat, then murdered it, Casey Anthony These rappers won't know what to do 'Cause all I did was act me like a Looney Tune And I'll give you all of me until there’s nothing left I swear this summer will be summer  Camp , bitch"
2842,Jake Owen - Barefoot Blue Jean Night,Jake Owen,2011,World/Traditional,"['contemporary country', 'country', 'country road']",contemporary country,country,country road,459065265,110093,,"[Verse 1] A full moon shining bright Edge of the water; we were feeling alright Back down a country road The girls are always hot, and the beer is ice cold Cadillac, horns on the hood My buddy Frankie had his dad hook him up good Girls smile when we roll by They hop in the back, and we cruise to the river side [Chorus] Never gonna grow up Never gonna slow down We were shinin' like lighters in the dark In the middle of a rock show We were doin' it right We were comin' alive Yeah, caught up in a Southern summer, a barefoot, blue jean night [Verse 2] Blue eyes and auburn hair Sittin' lookin' pretty by the fire in a lawn chair New to town, and new to me Her ruby red lips was sippin' on sweet tea Shot me in love like a shootin' star So, I grabbed a beer and my ol' guitar Then we sat around till the break of dawn Howlin' and singin' our favorite song [Chorus] Never gonna grow up Never gonna slow down We were shinin' like lighters in the dark In the middle of a rock show We were doin' it right We were comin' alive Yeah, caught up in a Southern summer, a barefoot, blue jean night Never gonna grow up Never gonna slow down We were shinin' like lighters in the dark In the middle of a rock show We were doin' it right We were comin' alive Yeah, caught up in a Southern summer, a barefoot, blue jean night [Outro] (Whoa-oh) Barefoot, blue jean night (Whoa-oh) A barefoot, blue jean night (Whoa-oh) Barefoot, blue jean night A barefoot, blue jean night It's a barefoot, blue jean night A barefoot, blue jean night"
2829,Ben Howard - Only Love,Ben Howard,2011,Pop,"['british singer-songwriter', 'folk-pop', 'indie folk']",british singer-songwriter,folk-pop,indie folk,456323852,70289,,"[Chorus] Darling, you're with me, always around me Only love, my only love Darling, I feel you under my body Only love, my only love Give me shelter, or show me heart Come on, love, come on, love Watch me fall apart, watch me fall apart... [Post-Chorus] And I'll be yours to keep A wind in the shadows, whale song in the deep A wind in the shadows, whale song in the deep [Chorus] Darling, you're with me, always around me Only love, my only love Darling, I feel you under my body Only love, my only love Give me shelter, or show me heart Come on, love, come on, love Watch me fall apart, watch me fall apart [Post-Chorus] And I'll be yours to keep A wind in the shadows, whale song in the deep A wind in the shadows, whale song [Chorus] Darling, you're with me, always around me Only love, my only love Darling, I feel you under my body Only love, my only love Give me shelter, or show me heart Come on, love, come on, love Watch me fall apart, watch me fall apart Watch me fall apart, watch me fall apart Watch me fall apart Watch me fall apart [Bridge] Only love, love, love Only love, love, love Only love, love, love Girl, show me heart Come on love, love, love Come on love, love, love Come on love, love, love Watch me fall apart Come on love, love, love Come on love, love, love Come on love, love, love Girl, show me heart Show me love, love, love Show me love, love, love Show me love, love, love Watch me fall apart Watch me fall apart [Outro] Darling, I feel you under my body Darling, you're with me, forever and always Give me shelter or show me heart And watch me fall apart, watch me fall apart"
,Alex G - Treehouse,Alex G,2011,,,,,,451981664,256934,Treehouse,"[Chorus] ""Do Not Enter"" is written on the doorway Why can't everyone just go away? Except you, you can stay What do you think of my treehouse? It’s where I sit and talk really loud Usually I'm all by myself Ooh [Verse] I'm the captain, but you can be the deputy I’m really glad you think I'm so funny I don't think I'm ever gonna let you leave [Chorus] ""Do Not Enter"" is written on the doorway Why can't everyone just go away? Except you, you can stay What do you think of my treehouse? It's where I sit and talk really loud Usually I'm all by myself Ooh [Verse] I'm the captain, but you can be the deputy I’m really glad you think I’m so funny I don't think I’m ever gonna let you leave"
2832,Beyoncé - Best Thing I Never Had,Beyoncé,2011,Pop,"['pop', 'r&b']",pop,r&b,Unknown,445522485,78013,,"[Intro] What goes around comes back around, hey (My baby) What goes around comes back around, hey (My, my, my baby) I say, what goes around comes back around, hey, hey (My baby) What goes around comes back around [Verse 1] There was a time I thought That you did everything right No lies, no wrong Boy, I must've been out of my mind [Pre-Chorus] So when I think of the time that I almost loved you You showed your ass and I, I saw the real you Thank God you blew it, I thank God I dodged the bullet, uh I'm so over you, so baby, good lookin' out [Chorus] I wanted you bad, I'm so through with that 'Cause honestly, you turned out to be the best thing I never had You turned out to be the best thing I never had And I'm gon' always be the best thing you never had Oh, yeah, I bet it sucks to be you right now [Verse 2] So sad, uh, you're hurt, boo-hoo Oh, did you expect me to care? You don't deserve my tears I guess that's why they ain't there [Pre-Chorus] When I think that there was a time that I almost loved you You showed your ass, and baby, yes, I saw the real you Thank God you blew it, I thank God I dodged the bullet I'm so over you, baby, good lookin' out [Chorus] I wanted you bad, I'm so through with that 'Cause honestly, you turned out to be the best thing I never had I said, you turned out to be the best thing I never had And I'll never be the best thing you never had Oh, baby, I bet it sucks to be you right now [Bridge] I know you want me back, it's time to face the facts That I'm the one that's got away, Lord knows that it would take Another place, another time, another world, another life Thank God, I found the good in goodbye [Chorus] I used to want you so bad, I'm so through with that (Ah) 'Cause honestly, you turned out to be the best thing I never had Oh, you turned out to be the best thing I never had And I will always be the best thing you never had Ooh, best thing you never had I used to want you so bad, I'm so through with that 'Cause honestly, you turned out to be the best thing I never had Oh, you turned out to be the best thing I never had Ooh, I will never be the best thing you never had Oh, baby, I bet it sucks to be you right now [Outro] What goes around comes back around (Oh) What goes around comes back around I bet it sucks to be you right now (Ooh) What goes around comes back around I bet it sucks to be you right now (Ooh) What goes around comes back around I bet it sucks to be you right now Ooh"
2839,Jason Derulo - It Girl,Jason Derulo,2011,Pop,"['dance pop', 'pop']",dance pop,pop,Unknown,444340292,163968,,"[Intro] Oh yeah, yeah Oh yeah [Verse 1] I been looking under rocks and breaking locks Just tryna find ya I been like a maniac, insomniac Five steps behind ya Tell them other girls, they can hit the exit, check please 'Cause I finally found the girl of my dreams Much more than a Grammy award That's how much you mean to me [Chorus] You can be my it girl, baby, you the shit, girl Loving you could be a crime Crazy how we fit, girl, this is it, girl Give me 25 to life I just wanna rock, all night long And put you in the middle of my spotlight You could be my it, girl, you're my biggest hit, girl Let me play it loud, let me play it loud like Oh oh oh oh oh, oh oh oh oh oh Let me play it loud, let me play it loud like Oh oh oh oh oh, oh oh oh oh oh Let me play it loud [Verse 2] You can't help but turn them heads, knocking 'em dead (Oh) Dropping like flies around you If I get your body close, not letting go (Oh) Hoping you're about to Tell 'em other guys they can lose your number, you're done They don't get another shot 'cause you're love drunk Like a TV show playing reruns Every chance I get, I'ma turn you on [Chorus] You can be my it girl, baby, you the shit, girl Loving you could be a crime Crazy how we fit, girl, this is it, girl Give me 25 to life (Hey) I just wanna rock, all night long And put you in the middle of my spotlight (Hey, yeah) You could be my it, girl, you're my biggest hit, girl Let me play it loud, let me play it loud like (Hey, yeah) Oh oh oh oh oh, oh oh oh oh oh (Oh, yeah) Let me play it loud, let me play it loud like Oh oh oh oh oh, oh oh oh oh oh Let me play it loud [Bridge] Can't seem to stop you from running, running Through my, through my mind, mind Just keep it coming, coming 'Til I make you mine, mine You've got that something, something, I wanna be with, girl (Wanna be with, girl) You're my greatest hit, girl (You're my greatest hit, girl) Just say this is it, girl Hey, baby Don't you know you're mine, girl? [Chorus] You can be my it girl, baby, you the shit, girl (Ooh, woo) Loving you could be a crime Crazy how we fit, girl, this is it, girl (Woo) Give me 25 to life (Give me 25 to life, baby) I just wanna rock, all night long And put you in the middle of my spotlight (Oh, yeah) You could be my it, girl, you're my biggest hit, girl (Oh, yeah) Let me play it loud, let me play it loud like (I'ma play it loud like) Oh oh oh oh oh, oh oh oh oh oh Let me play it loud, let me play it loud like (Baby, let me play it loud like, yeah) Oh oh oh oh oh, oh oh oh oh oh Let me play it loud Let me hear you sing like Oh oh oh oh oh, oh oh oh oh oh Everybody in the crowd, let me hear you singing like This is it, girl"
