Unnamed: 0,Artist and Title,Artist,Year,main_genre,genres,first_genre,second_genre,third_genre,Streams,Daily,Title,lyrics
3017,Foster The People - Call It What You Want,Foster The People,2011,Electronic/Dance,"['indietronica', 'modern alternative rock', 'modern rock', 'rock']",indietronica,modern alternative rock,modern rock,147919626,31537,,"[Chorus] Call it what you want, eh, eh, eh Call it what you want, eh, eh, eh I said, just call it what you want, eh, eh, eh Call it what you want [Verse 1] Yeah, we're locked up in ideas We like to label everything Well, I'm just gonna do here what I gotta do here 'Cause I gotta keep myself free You're ducking and moving just to hide your bruises From all your enemies And I'm in the crossfire dodging bullets From your expectancies, yeah, yeah [Pre-Chorus] Ooh, we got nothing to lose You better run and hide, yeah, you crossed the line I got a knife behind my back, just sayin' Ooh, we got nothing to prove Your social guides give you swollen eyes But what I got can't be bought, so you can just [Chorus] Call it what you want, eh, eh, eh Call it what you want, eh, eh, eh I said, just call it what you want, eh, eh, eh Call it what you want [Verse 2] You've taken your words and you take your judgments And stick 'em onto everything If it don't conform to what you were born into Then you run the other way You say, ""Now what's your style and who do you listen to?"" Who cares? Well, that rat race ladder-climbing fake-face smile's Got nothing on me, yeah, yeah [Pre-Chorus] Ooh, we got nothing to lose You better run and hide, yeah, you crossed the line I got a knife behind my back, just sayin' Ooh, we got nothing to prove Your social guides give you swollen eyes But what I got can't be bought, so you can just [Chorus] Call it what you want, eh, eh, eh Call it what you want, eh, eh, eh I said, just call it what you want, eh, eh, eh Call it what you want Want, want, want, want [Bridge] What you want, want, want Call it what you want, want, want You can call it what you want What you want, want, want Call it what you, call it what you want What you want, want, want You can call it, you can call it what you want [Outro] Eh, eh, eh, call it what you want Eh, eh, eh I said, just call it what you want, eh, eh, eh Call it what you want"
,Aaron Lewis - Country Boy,Aaron Lewis,2011,,,,,,147432747,32630,Country Boy,"[Verse 1: Aaron Lewis] Now I grew up down an old dirt road, in a town you wouldn't know My pops picked the place up for fifteen hundred bucks, back in nineteen sixty-four My grandfather was a drinker, back in the day he'd put 'em down But a war is known to change a man, and the whiskey's known to change a man [Chorus: Aaron Lewis] But, that's not me I rarely drink from the bottle, but I'll smoke a little weed I still live in the sticks where you wouldn't go, in a town of twelve hundred off an old dirt road And a country boy, is all I'll ever be [Verse 2: Aaron Lewis & George Jones] Now it's been twelve years since I sold my soul, to the devil in L.A He said sign your name here on the dotted line, and your songs they all will play He set up shop on Sunset, he put me up at the Marquee He said, ""You wanna sell a million records, boy? You better listen to me"" [Bridge: Aaron Lewis & George Jones] He said, ""Change your style, whiten your smile You could lose a couple pounds If you want to live this life, you'd better lose that wife Do you need your friends around?"" [Chorus: Aaron Lewis] I said, ""no that's not me"" 'Cause the biggest things in life are your friends and family And I like my jeans and my old t-shirts, and a couple extra pounds never really hurt 'Cause a country boy, is all I'll ever be [Verse 2: Aaron Lewis] 'Cause Hank taught me just how to stay alive You'll never catch me out the house without my nine or fourty-five I've got a big orange tractor and a diesel truck, and my idea of heaven's chasin' white tail bucks And as a country boy, I know I can survive [Verse 3: Aaron Lewis] Now two flags fly above my land, and really sum up how I feel One is the colors that fly high and proud, the red, the white, the blue The other one's got a rattlesnake, with a simple statement made ""Don't tread on me"" is what it says, and I'll take that to my grave [Chorus: Aaron Lewis] Because, this is me I'm proud to be American and strong in my beliefs And I've said it before, but I'll say it again, 'cause I've never needed government to hold my hand And I've said it before, but I'll say it again, 'cause my family's always fought and died to save this land And a country boy, is all I'll ever be [Outro: Charlie Daniels] I love my country, I love my guns, I love my family, I love the way it is now And anybody that tries to change it, has to come through me That should be all of our attitudes, 'cause this is America, and a country boy is good enough for me, son"
,C418 - Wet Hands,C418,2011,,,,,,146789572,87735,Wet Hands,0
3021,The Weeknd - Loft Music,The Weeknd,2011,R&B/Soul,"['canadian contemporary r&b', 'canadian pop', 'pop']",canadian contemporary r&b,canadian pop,pop,146661340,44234,,"[Intro] Oh, oh-ooh Oh (Woah), oh (Woah) Oh, oh [Verse] They say my brain meltin' And the only thing I'll tell 'em is I'm livin' for the present and the future don't exist So, baby, take your clothes off, a chance like this You may never get to show off, show off Show off what you talking about Unless you like to tease, baby When in reality you don't know how to please, baby Blue-ball queen, take your fuckin' seat, baby Ride it out, now I know you wanna scream, baby Better than your next man And if he swingin' I get dumber than the next man 'Cause I don't play Unless it's keys, then I play all day (All day) You like them keys? We gon' play all day (All day) Wet dream fry your brain all day, all day I think you lost your morals, girl (What?) But it's okay 'cause you don't need 'em where we're goin' In that two-floor loft in the middle of the city After rollin' through the city with me I promise you gon' see That I'm only fuckin' 20, girl Amnesia, put your mind in a dream world What you doin' in the bathroom? (Woah) I hear noises in the bathroom (Woah) Baby, it's okay We can do it in the living room Twisting turns in 'em, the only girls that we fuck with Seem to have 20 different pills in 'em They tell us that they love us Even though they want a next man And the next man's bitch want the third man Eddie Murphy shit, yeah, we trade places Rehearse lines to them and then we fuck faces Yeah, we know just how to get a buzz Mix it with the hash, come fuck with us I'm raw, mothafucka, I'm raw Love so lost, and my niggas, man These bitches can't touch what we got if they wanted I'll plug any nigga that'll step, man, I got 'em, yeah, I got 'em 'til the ending of our credits Life's such a movie, filmed independent, us against the city Please don't get offended when we don't answer your calls And if you got a problem, come and find us, we can talk about it What's good, young ho? You about it? Got a loft right now, you excited? You excited? [Outro] Ooh, ooh Ah, ah Ooh-ahh What you thinkin' about? What you thinkin' about? Yeah What you thinkin' about? Ooh, what you thinkin' about? What you thinkin' about? What you thinkin' about? What you thinkin'? I been thinkin' 'bout, ooh I know everything, ooh I know everything I know it all I know it all Ahh, ahh, ahh, ooh Ooh-ahh, ahh, ahh Ooh, oh no, no, no Ahh, ahh-ooh, ooh"
3052,Jim Croce - I Got a Name (Stereo Version),Jim Croce,2011,Rock,"['classic rock', 'country rock', 'folk', 'folk rock', 'mellow gold', 'singer-songwriter', 'soft rock']",classic rock,country rock,folk,145856859,67173,,"Check it out y'all Some people say Connecticut can't rock But I'm here to make you all hip and hop It's not about the freak, it's not about the rock It's a brand new dance we call the Punk Rock It's kinda like the Dog and it's kinda like the Duke Come on everybody lemme see your body work But first of all, I'd like to let you all know That I'm here to bust ya out in stereo I said the name of the MC you're checkin' out Is one of the baddest, without a doubt Said I go by the name of the double M Mr. Magic, I tell you once again And when I get down the MCs check me out 'Cause they know I'm the funky MC sure shot Let's rock, let's rock Whether you're walkin' down the street with your box in your hand Or you're sittin' in your house, checkin' out this jam Well you might be at the disco throwin' down so hard Or you might be cruisin' and ridin' in your car This is a rap from New Haven's funky MC crew Here to bust ya out on turntables one and two One time, shock the house Two times, shock the house I said the women like me for my sex And my name's Mr. Magic and I must confess When I kiss their lips, I feel their chests They say ""Mr. Magic you are better than the rest"" Well you know my name, it ain't about Females, get ready so I can bust you all out Females, shock the house Fly guys, shock the house Everybody, shock the house I'm the L-O-V-E the B-O-Y The boy is bad, you can't deny I said I float like a butterfly, sting like a bee I'm not talkin' 'bout just what your eyes can see Like a Ricochet Rabbit and a Droop-a-Long I'm Mr. Magic, here on the microphone Young ladies delight, young ladies galore I'm Mr. Magic and I summons you to the floor You rock it to the rhythm and you rock to the sound That this MC here, is puttin' down I said come on girls, you know what to do Keep rockin' to the rhythm like I tell ya to Now throw your hands in the air And rock 'em to the beat like you just don't care Now if you feel like makin' a little noise On the count of two say ""Magic and the crew"" One, two (Magic and the crew!) Like a Charlie Brown, who's got a hit Fly guys let me hear you say oh shit (Oh shit!) I said me and the devil had a fight Well I hit him in the head with a loopin' right By the look in his eyes I can see he was surprised I knew he couldn't take much more So I said to myself just how much more Can this mother-suckin' devil DJ endure Let's rock, let's rock Let's rock to the rhythm that just don't stop Now everybody, when I say ""Don't stop"" I wanna hear you all say ""The rock-rock-rock"" Don't stop (The rock-rock-rock!) Don't stop (The rock-rock-rock!) Like a Jimmy Carter with his big white teeth Like a Little Bo Peep who lost her sheep Like Isaac Hayes, he simply was amazed When I rocked the mic and put him in a daze Like the Frankie Crocker show, don't you know we're on? Like my man Jazzy who will rock you on and on Like Bernard [?] for [?] I'm gonna rock and freak ya all out tonight Well as we travel all through the state gettin' down And I must start off with my own hometown We're New Haven y'all, where I first got my chance When I rocked the mic and put you in a trance You go dip-dip dive and so-socialize You're rockin' with the baddest MC alive Go on and on, and on and on It goes on like hot butter on what? (Popcorn!) Like a Ginger Rogers and a Fred Astaire New Haven, lemme hear you say ""Oh yeah"" (Oh yeah!) Go oooh-oooh (Oooh-oooh!) Ooooh-oooh (Oooh-oooh!) So if you hear me say the name of your town Just let me know you're there by sayin' ""We're down!"" Stamford! (We're down!) Norwalk! (We're down!) Bridgeport! (We're down!) New Haven! (We're down!) Ansonia! (We're down!) Waterbury! (We're down!) Meriden! (We're down!) Middletown! (We're down!) Hartford! (We're down!) Well don't you know I went on I went further up north past [?] When I bust 'em out, in stereo I said Windsor, Connecticut I made a stop too Well I made everybody do the boogaloo I said out of Connecticut, in Springfield Where I shocked the ladies, and gave them a thrill They said ""Mr. Magic, you're doin' the real deal"" By the time I hit Boston the punk rock was on Well I rocked everybody to the break of dawn Well I rocked them good, I rocked them the best I rocked them with style and I rocked with finesse I went into New York City where the women are so pretty Rockin' on the microphone New York, check me out, 'cause I'm hot I'm Connecticut's number one MC jock So you other MCs better watch your step Because I'm from Connecticut and I'm the best yet Said the word was out, I was comin' to town I was comin' to the Garden to get down It was the biggest job that I ever had Let me tell you that this MC was mighty glad Because never before, not even in my wildest dreams I never coulda even thought to that extreme Not on the [?] and don't be late I be rockin' the whole damn New York state Got me and Madison Square Garden in rare form Let me tell you I was really ready to perform They came from the Bronx, Brooklyn and Manhattan They came from Harlem too They came by plane, boat and car They even came by the old choo-choo They came from New Jersey, Philly, and DC They all wanted to pay a look at me They came from North and South Carolina Florida, Chicago, and Long Island They came from Atlanta, LA, and Hollywood Let me tell you that it had to be mighty good It was a day and time New York will never forget When I rocked 'em on the mic from [?] to Mississip- I said M-R-M-A-G Then you add a little I, then you add a little C Now clap your hands Stomp your feet Now clap your hands, stomp your feet Everybody get down to the disco beat Now for all the people who are crowded all around If I say your city, state, or town say ""We're down"" Boston! (We're down!) Springfield! (We're down!) Connecticut! (We're down!) New York! (We're down!) Brooklyn! (We're down!) Harlem! (We're down!) Bronx! (We're down!) Manhattan! (We're down!) Long Island! (We're down!) New Jersey! (We're down!) Philly! (We're down!) DC! (We're down!) North Carolina! (We're down!) South Carolina! (We're down!) Atlanta! (We're down!) Chicago! (We're down!) LA! (We're down!) Hollywood! (We're down!) When Don Cornelius called me up [?] the show Well I packed my bags and I was ready to go I snatched a 747 out of the sky Jumped in the driver's seat and I started to fly Now here I am on the Soul Train show Everybody's waitin' for me to go I started out by sayin' once upon a time A very long time ago There were two sisters named Stella and Bertha But they didn't have a stereo So they made up a dance everybody called the ""Bertha Butt Boogie"" She said everybody better look out 'Cause I'm Bertha and I'll sock it to ya So movin' right along, back up my time, back in the 1980s Now everybody know the punk rock's on 'Cause I'm on Soul Train, singin' my song For all the people in the Soul Train line I want you all to turn loose and shake your behind So right after I finished singin' my song Don came out and said that I was really right on So we talked for awhile [?] end the show He said these words before I go He said peace and love to all of you Then I jumped on the mic and said bye too Now just because I didn't name your town Don't think that it means you can't get down It's just that it's, the end of the song And I really must be movin' on So [?] it's time to go You've been checkin' out the sure-shot MC show To the beat To the beat To the beat-beat-beat-b-beat! [Break to Fade Out]"
,Exaltasamba - Tá Vendo Aquela Lua,Exaltasamba,2011,,,,,,145004034,46059,Tá Vendo Aquela Lua,"[Verso: Thiaguinho] Te filmando, eu tava quieto no meu canto Cabelo bem cortado, perfume exalando Daquele jeito que eu sei que você gosta Mas eu te dei um papo e você nem deu resposta Tudo bem, um dia vai o outro vem! Você deve estar pensando em outro alguém Mas se ele te merecesse não estaria aqui Não, não, não! Ou talvez você não queira se envolver Magoada, tá com medo de sofrer Se me der uma chance, não vai se arrepender Não, não, não, não, não! [Refrão: Thiaguinho, Exaltasamba] Tá vendo aquela lua que brilha lá no céu? Se você me pedir, eu vou buscar só pra te dar Se bem que o brilho dela nem se compara ao seu Deixa eu te dar um beijo, vou mostrar o tempo que perdeu Que coisa louca, eu já sabia! Enquanto eu me arrumava, algo me dizia: ""Você vai encontrar alguém que vai mudar A sua vida inteira da noite pro dia!"" Tá vendo aquela lua que brilha lá no céu? Se você me pedir, eu vou buscar só pra te dar Se bem que o brilho dela nem se compara ao seu Deixa eu te dar um beijo, vou mostrar o tempo que perdeu Que coisa louca, eu já sabia! Enquanto eu me arrumava, algo me dizia: ""Você vai encontrar alguém que vai mudar A sua vida inteira da noite pro dia!"" [Verso: Thiaguinho, Exaltasamba] Te filmando, eu tava quieto no meu canto Cabelo bem cortado, perfume exalando Daquele jeito que eu sei que você gosta Mas eu te dei um papo e você nem deu resposta, não Tudo bem, um dia vai, o outro vem! Você deve estar pensando em outro alguém Mas se ele te merecesse não estaria aqui Não, não, não! Ou talvez você não queira se envolver Magoada, tá com medo de sofrer Se me der uma chance, não vai se arrepender Não, não, não, não, não! [Refrão: Thiaguinho & Exaltasamba] Tá vendo aquela lua que brilha lá no céu? Se você me pedir, eu vou buscar só pra te dar Se bem que o brilho dela nem se compara ao seu Deixa eu te dar um beijo, vou mostrar o tempo que perdeu Que coisa louca, eu já sabia! Enquanto eu me arrumava, algo me dizia: ""Você vai encontrar alguém que vai mudar A sua vida inteira da noite pro dia!"" Tá vendo aquela lua que brilha lá no céu? Se você me pedir, eu vou buscar só pra te dar Se bem que o brilho dela nem se compara ao seu Deixa eu te dar um beijo, vou mostrar o tempo que perdeu Que coisa louca, eu já sabia! Enquanto eu me arrumava, algo me dizia: ""Você vai encontrar alguém que vai mudar A sua vida inteira da noite pro dia!"" [Saída: Thiaguinho] Te filmando, eu tava quieto no meu canto..."
2770,Avicii - Levels,Avicii,2011,Pop,"['dance pop', 'edm', 'pop', 'pop dance']",dance pop,edm,pop,144799231,72072,,"[Instrumental] [Chorus: Etta James] Oh, sometimes I get a good feeling, yeah Get a feeling that I never, never, never, never had before, no, no I get a good feeling, yeah Oh, sometimes I get a good feeling, yeah Get a feeling that I never, never, never, never had before, no, no I get a good feeling, yeah [Instrumental]"
3044,Avicii - Levels,Avicii,2011,Pop,"['dance pop', 'edm', 'pop', 'pop dance']",dance pop,edm,pop,144799231,72072,,"[Instrumental] [Chorus: Etta James] Oh, sometimes I get a good feeling, yeah Get a feeling that I never, never, never, never had before, no, no I get a good feeling, yeah Oh, sometimes I get a good feeling, yeah Get a feeling that I never, never, never, never had before, no, no I get a good feeling, yeah [Instrumental]"
,Model - Değmesin Ellerimiz,Model,2011,,,,,,144485133,84464,Değmesin Ellerimiz,"[""Değmesin Ellerimiz"" için şarkı sözleri] [Bölüm] Ah, ne zormuş ""Bitsin"" demek hâlâ severken seni Dudaklarını öpmemek bir yabancı gibi Bilirsin, ayrılık konusunda iyi değiliz ikimiz de Bir kıvılcım yeterdi her zaman koşup geri dönmemize [Ön Nakarat] Değmesin ellerimiz, buluşmasın bu gözler Yine erir gideriz, unutulur yeminler [Nakarat] Biz hiç beceremedik sevmeyi de terk etmeyi de Aşk kokan dudakların karşısında direnmeyi de Biz hiç beceremedik sevmeyi de terk etmeyi de Aşk dolu mısraların karşısında direnmeyi de [Bölüm] Ah, ne zormuş ""Bitsin"" demek hâlâ severken seni Dudaklarını öpmemek bir yabancı gibi Bilirsin, ayrılık konusunda iyi değiliz ikimiz de Bir kıvılcım yeterdi her zaman koşup geri dönmemize [Ön Nakarat] Değmesin ellerimiz, buluşmasın bu gözler Yine erir gideriz, unutulur yeminler [Nakarat] Biz hiç beceremedik sevmeyi de terk etmeyi de Aşk kokan dudakların karşısında direnmeyi de Biz hiç beceremedik sevmeyi de terk etmeyi de Aşk dolu mısraların karşısında direnmeyi de [Köprü] İşte bir kez daha durup karşında Belki de son defa soruyorum sana Bitti mi hikâyemiz, bu ne biçim son böyle? Değmez miydi sevgimiz savaşıp direnmeye? [Ön Nakarat] Değmesin ellerimiz, buluşmasın bu gözler Yine erir gideriz, unutulur yeminler [Nakarat] Biz hiç beceremedik sevmeyi de terk etmeyi de Kendimize sahip çıkıp dünyayla yüzleşmeyi de Biz hiç beceremedik sevmeyi de terk etmeyi de Korktuğumuz o gözlerin karşısında direnmeyi de [Çıkış] Bitmesin hikâyemiz"
3034,Chris Young - Tomorrow,Chris Young,2011,World/Traditional,"['contemporary country', 'country', 'country road']",contemporary country,country,country road,143994425,74116,,"[Verse 1] Tomorrow I'm gonna leave here I'm gonna let you go and walk away Like every day I said I would And tomorrow, I'm gonna listen To that voice of reason inside my head Telling me that we're no good [Chorus] But, tonight I'm gonna give in one last time Rock you strong in these arms of mine Forget all the regrets that are bound to follow We're like fire and gasoline I'm no good for you, you're no good for me We only bring each other tears and sorrow But tonight, I'm gonna love you like there's no [Verse 2] Tomorrow I'll be stronger I'm not gonna break down and call you up When my heart cries out for you And tomorrow, you won't believe it But when I pass your house, I won't stop No matter how bad I want to [Chorus] But, tonight I'm gonna give in one last time Rock you strong in these arms of mine Forget all the regrets that are bound to follow We're like fire and gasoline I'm no good for you, you're no good for me We only bring each other tears and sorrow But tonight, I'm gonna love you like there's no Tomorrow [Bridge] Baby, when we're good, you know we're great But there's too much bad for us to think That there's anything worth trying to save [Chorus] But tonight I'm gonna give in one last time Rock you strong in these arms of mine Forget all the regrets that are bound to follow We're like fire and gasoline I'm no good for you, you're no good for me We only bring each other tears and sorrow But tonight, I'm gonna love you like there's no [Outro] Tomorrow, I'm gonna leave here Yeah, I'm gonna let you go and walk away Like every day I said I would"
,Hugo - 99 Problems,Hugo,2011,,,,,,143673015,64462,99 Problems,"[Intro] If you're having girl problems I feel bad for you, son I got 99 problems and a bitch ain't one [Verse 1] Tip my hat to the sun in the west Feel the beat right in my chest At the crossroads a second time Make the devil change his mind It's a pound of flesh but it's really a ton 99 problems and a bitch ain't one [Chorus] If you're having girl troubles I feel bad for you, son I've got 99 problems and a bitch ain't one 99 problems, but a bitch ain't one [Verse 2] Like broken glass under my feet I could lose my mind in this heat Looking for the prize but I don't want blood I order one drink then I drink the flood You can come inside, but your friends can't come 99 problems and a bitch ain't one [Chorus] If you're having girl problems I feel bad for you, son 99 problems and a bitch ain't one I've got 99 [Outro] 99, 99, 99 99 problems But a bitch ain't one 99 99 problems, but a bitch ain't one"
3020,Cage The Elephant - Shake Me Down,Cage The Elephant,2011,Rock,"['modern alternative rock', 'modern rock', 'pov: indie', 'punk blues', 'rock']",modern alternative rock,modern rock,pov: indie,143222735,32157,,"[Verse 1] Shake me down, not a lot of people left around Who knows now? Softly laying on the ground Oooh not a lot of people left around oooh oooh In my life I have seen people walk into the sea Just to find memories plagued by constant misery Their eyes cast down, fixed upon the ground Their eyes cast down [Chorus] I'll keep my eyes fixed on the sun [Verse 2] Shake me down, cut my head on a silver cloud Broken sound, softly laying on the ground Oooh not a lot of people left around oooh oooh In my past, bittersweet, there's no love between the sheets Taste the blood, broken dreams, lonely times in deed With eyes cast down, fixed upon the ground, with eyes cast down [Chorus] I'll keep my eyes fixed on the sun [Bridge] Turn back now, it's time for me to let go Way down, had to find a place to lay low Lamp shade, turned around into a light post [Breakdown] Walk around the corner, never saw it coming, still I try to make a move it almost stopped me from belief I don't want to know the future, I'm like Rolling Thunder [Refrain] Even on a cloudy day Even on a cloudy day Even on a cloudy day Even on a cloudy day Even on a cloudy day Even on a cloudy day Even on a cloudy day [Chorus] I'll keep my eyes fixed on the- I'll keep my eyes fixed on the- I'll keep my eyes fixed on the sun [Outro] Shake me down, not a lot of people left around Oooh oooh"
