Unnamed: 0,Artist and Title,Artist,Year,main_genre,genres,first_genre,second_genre,third_genre,Streams,Daily,Title,lyrics
,Cali Swag District - Teach Me How to Dougie,Cali Swag District,2011,,,,,,256720087,157917,Teach Me How to Dougie,"[Intro: Smoove] Ayy, ayy Teach me how to Dougie, ayy [Verse 1: Smoove] They be like ""Smoove (What?) Can you teach me how to Dougie?"" You know why? 'Cause all the bitches love me (Ayy) All I need is a beat that's super-bumpin' And for you, you, and you to back it up and dump it (Get it) Put your arms out front, lean side-to-side (Yeah) They gonna be on you when they see you hit that Dougie right Ain't nobody fuckin' with my bro from Morningside He go by ""Bubba,"" and he hit that dance like thunder (Okay) I ain't from Dallas, but I D-Town boogie I show my moves off now, everybody tryna do me (Jockin') I leave the functions, and all the ladies tryna screw me (On me) Now you just do you, and I'ma do me (All day) Niggas love to hate, so they try to shoot me Bitches be stuck to me, I think they try to glue me I make the party shine bright when it started gloomin' This beat was bubblegum, so I had to chew it [Chorus: Smoove] Teach me how to Dougie, teach me-teach me how to Dougie  (Dougie) Teach me how to Dougie, teach me-teach me how to Dougie (Dougie) All my bitches love me, all my-all my bitches love me All my bitches love me, you ain't fuckin' with my Dougie Teach me how to Dougie, teach me-teach me how to Dougie (Dougie) Teach me how to Dougie, teach me-teach me how to Dougie (Dougie) All my bitches love me, all my-all my bitches love me All my bitches love me, you ain't fuckin' with my Dougie [Verse 2: Yung] The name is Yung (Yup) for them dudes who don't know me I know I'm from the West, but I can teach you how to Dougie I step up in the club, and all these bitches bug me On a nigga dancin', none of 'em know me I hear the squad screamin' like, ""Ayy, get it, brodie"" So I move my shoulders and I take it real low They like ""How he do that? He can Dougie on the floor"" And when that nigga stop, they like ""Dougie some mo'"" I'm like ""A nigga kinda tired,"" then I pass it to the bro M-Bone, show these cats how to do that Down South dance that we learned a lil' too fast And brought it to the hood and got the whole crew ass [Chorus: Smoove] Teach me how to Dougie, teach me-teach me how to Dougie  (Dougie) Teach me how to Dougie, teach me-teach me how to Dougie (Dougie) All my bitches love me, all my-all my bitches love me All my bitches love me, you ain't fuckin' with my Dougie Teach me how to Dougie, teach me-teach me how to Dougie (Dougie) Teach me how to Dougie, teach me-teach me how to Dougie (Dougie) All my bitches love me, all my-all my bitches love me All my bitches love me, you ain't fuckin' with my Dougie [Verse 3: Jay Are] Back of the party, I don't really like to boogie I'm just tryna get bent and meet a thick redbone (Hm) She do her Dougie and all them bitches hatin' But I'm 'bout to escape with a bitch and head home (Fuck it) She got her friend, so it's a two-man and I wanna run it even if her legs long (Yup) She like ""You hubby,"" I think she love me But, I change the subject and I do my Dougie (Ha) 'Cause I don't give a fuck, blow trees, get money Me, Smoove, Heff in the back with Playboy bunnies We gon' make em do the Dougie in the middle of the bed And when I asked for some head, this bitch looked at me funny Dawg, bitch, you can't tell me nothin' Star made the beat, and I just took it out the oven I just see the Dougie when everybody clubbin' And I hate skinny jeans 'cause the burner keep rubbin' [Chorus: Smoove] Teach me how to Dougie, teach me-teach me how to Dougie  (Dougie) Teach me how to Dougie, teach me-teach me how to Dougie (Dougie) All my bitches love me, all my-all my bitches love me All my bitches love me, you ain't fuckin' with my Dougie Teach me how to Dougie, teach me-teach me how to Dougie (Dougie) Teach me how to Dougie, teach me-teach me how to Dougie (Dougie) All my bitches love me, all my-all my bitches love me All my bitches love me, you ain't fuckin' with my Dougie [Outro: Smoove] (All my bitches love me, all my-all my bitches love me) (All my bitches love me, all my-all my bitches love me) (All my bitches love me, all my-all my bitches love me) (All my bitches love me, you ain't fuckin' with my Dougie)"
2951,Maná - Amor Clandestino,Maná,2011,Pop,"['latin arena pop', 'latin pop', 'latin rock', 'mexican pop', 'mexican rock', 'rock en espanol']",latin arena pop,latin pop,latin rock,256066066,227282,,"[Letra de ""Amor clandestino""] [Verso 1] Eres inevitable, amor Casi como respirar Casi como respirar Llegué a tus playas impuntual Pero no me rendiré Soy tu amor clandestino [Pre-Coro] Soy el viento sin destino Que se cuela en tus faldas, mi amor Un soñador, un clandestino Que se juega hasta la vida, mi amor Clandestino Ámate, amada, amor No, no, no, no [Coro] Mi amor clandestino en el silencio, el dolor Se nos cae todo el cielo de esperar Inevitable, casi como respirar Se nos cae todo el cielo de tanto esperar Clandestino [Verso 2] El universo conspiró Inevitable, corazón Clandestino eterno amor Pero me duele no gritar Tu nombre en toda libertad Bajo sospecha hay que callar [Pre-Coro] Y te sueño piel con piel Ahogado en besos y tus risas amor Y me hundo en el calor Que hay en tus mundos, en tu mar Llorando en silencio Temblando a tu ausencia Rogándole al cielo Y fingiendo estar muy bien No, no, no, no [Coro] Mi amor clandestino en el silencio, el dolor Se nos cae todo el cielo de tanto esperar Inevitable, casi como respirar Se nos cae todo el cielo de tanto esperar Clandestino [Puente] No te engañes más, ya no te mientas Ese aire ya pasó, ya pasó Y verdad, ya no tengas miedo Sólo tú mantienes mi respiración [Breakdown] Hace tanto que yo esperaba al viento, amor Cae el llanto del cielo de esperar Hace tanto que yo esperé tu luz, mi amor Ay amor, ay amor, ay amor [Outro] Se nos cae todo el cielo Se nos cae todo el cielo de tanto esperar Mi amor ya no te engañes No te mientas corazón Se nos cae todo el cielo, entiéndelo"
2920,Alex Clare - Too Close,Alex Clare,2011,Rock,['modern alternative rock'],modern alternative rock,Unknown,Unknown,253130836,58159,,"[Verse 1] You know I'm not one to break promises I don't want to hurt you, but I need to breathe At the end of it all, you're still my best friend But there's something inside that I need to release [Pre-Chorus] Which way is right? Which way is wrong? How do I say that I need to move on? You know we're heading separate ways [Chorus] And it feels like I am just too close to love you There's nothing I can really say I can't lie no more I can't hide no more Got to be true to myself And it feels like I am just too close to love you So I'll be on my way [Verse 2] You've given me more than I can return Yet there's oh so much that you deserve Nothing to say, nothing to do I've nothing to give, I must live without you You know we're heading separate ways [Chorus] And it feels like I am just too close to love you There's nothing I can really say I can't lie no more I can't hide no more Got to be true to myself And it feels like I am just too close to love you So I'll be on my way [Post-Chorus] So I'll be on my way [Chorus] And it feels like I am just too close to love you There's nothing I can really say I can't lie no more I can't hide no more Got to be true to myself And it feels like I am just too close to love you So I'll be on my way [Outro] So I'll be on my way So I'll be on my way"
2946,Frank Ocean - Swim Good,Frank Ocean,2011,Hip-Hop/Rap,"['lgbtq+ hip hop', 'neo soul']",lgbtq+ hip hop,neo soul,Unknown,252018282,126940,,"[Verse 1: Frank Ocean & Tyler, The Creator] That's a pretty big trunk on my Lincoln Town Car, ain't it? Big enough to take these broken hearts and put 'em in it Now I'm drivin' 'round on the boulevard, trunk bleedin' And every time the cops pull me over, they don't ever see them They never see them ( Wow ) [Pre-Chorus: Frank Ocean] And I've got this black suit on Roamin' around like I'm ready for a funeral Five more miles 'til the road runs out [Chorus: Frank Ocean] I'm about to drive in the ocean I'ma try to swim from somethin' bigger than me Kick off my shoes And swim good, and swim good Take off this suit And swim good, and swim good, good [Post-Chorus: Frank Ocean] Don't, Don't die Don't die, don't die Don't, oh, no Don't die, don't die [Verse 2: Frank Ocean] Got some pretty good beats on this 808s CD, yeah (Yeah) Memory seats I'm sittin' on stay heated (Yeah) I woulda put tints on my windows, but what's the difference? If I feel like a Ghost (No Swayze) Ever since I lost my baby [Pre-Chorus: Frank Ocean & Tyler, The Creator] I've had this black suit on ( Wow ) Roamin' around like I'm ready for a funeral ( Wow ) One more mile 'til the road runs out, out [Chorus: Frank Ocean] I'm about to drive in the ocean I'ma try to swim from somethin' bigger than me Kick off my shoes And swim good, and swim good Take off this suit And swim good, and swim good, good [Bridge: Frank Ocean] I'm goin' off (Oh, my pretty love) Don't try stopping me I'm goin' off (Throw me a line) Don't try saving (You broke my heart) No flares (You broke my heart) No vest (You drove my love) And no fear Waves are washin' me out [Chorus: Frank Ocean] I'm about to drive in the ocean (Drive in the ocean, yeah) I'ma try to swim from somethin' bigger than me (Bigger than me) Kick off my shoes (Good) And swim good, and swim good (Good) Take off this suit (Take off this suit, woah) And swim good, and swim good, good (Yeah) [Outro: Frank Ocean] Don't, Don't die Don't die, don't die Don't, oh, no Don't die, don't die Don't, Don't die Don't die, don't die Don't, oh, no Don't die, don't die"
2936,Luke Bryan - Drunk On You,Luke Bryan,2011,World/Traditional,"['contemporary country', 'country', 'country road', 'modern country rock']",contemporary country,country,country road,248905012,109915,,"[Verse 1] Cottonwood fallin' like snow in July Sunset, riverside, four wheel drives in a tail light circle Roll down the windows, turn it on up Pour a little crown in a dixie cup Get the party started [Chorus] Girl, you make my speakers go boom boom Dancin' on the tailgate in a full moon That kinda thing makes a man go mm-mm You're lookin' so good in what's left of those blue jeans Drip of honey on the money maker gotta be The best buzz I'm ever gonna find Hey, I'm a little drunk on you And high on summertime [Verse 2] If you ain't a 10, you're a 9.9 Tippin' n' spillin' that home-made wine On your tied up T-shirt Every little kiss is drivin' me wild Throwin' little cherry bombs into my fire Good God almighty [Chorus] Girl, you make my speakers go boom boom Dancin' on the tailgate in a full moon That kinda thing makes a man go mm-mm You're lookin' so good in what's left of those blue jeans Drip of honey on the money maker gotta be The best buzz I'm ever gonna find Hey, I'm a little drunk on you And high on summertime [Bridge] Let's slip on out where it's a little bit darker And when it gets a little bit hotter We'll take it off on out in the water [Chorus] Girl, you make my speakers go boom boom Dancin' on the tailgate in a full moon That kinda thing makes a man go mm-mm You're lookin' so good in what's left of those blue jeans Drip of honey on the money maker gotta be The best buzz I'm ever gonna find Hey, I'm a little drunk on you And high on summertime [Outro] Yeah, I'm a little drunk on you"
2948,Cody Johnson - Diamond In My Pocket,Cody Johnson,2011,World/Traditional,"['classic texas country', 'contemporary country', 'modern country pop']",classic texas country,contemporary country,modern country pop,248834110,49547,,"[Verse 1] Saturday night and the moon is out Just shinin' over top of the pines I'm headin' on down to my baby's house Gonna take her on a midnight ride Down them backroads winding up at Kickapoo Creek Dancin' and singin' to some good ol' boys like me [Chorus] Baby, there's a shooting star That one's for me and you So hold me tight and make that wish and pray that it comes true I ain't sure of much but this I know I got a diamond in my pocket and my baby's got a heart of gold [Verse 2] I brought along a little courage and a Coleman cooler Just to help me out My hands are shaking like a Canebrake rattler Nothing's gonna save me now Might as well jump in head first, lay it all on the line What am I worrying about, never gonna be a more perfect time [Chorus] Cause baby, there's a shooting star That one's for me and you So, hold me tight and make that wish and pray that it comes true I ain't sure of much but this I know I got a diamond in my pocket and my baby's got a heart of gold [Bridge] Well I didn't have money for a Broadway show But the crickets are singing to the radio And we got tickets on the very front row [Chorus] Baby, there's a shooting star That one's for me and you So hold me tight and make that wish and pray that it comes true I ain't sure of much but this I know I got a diamond in my pocket and my baby's got a heart of gold I got a diamond in my pocket and my baby's got a heart of gold"
,Jesse & Joy - Llorar,Jesse & Joy,2011,,,,,,248233304,212225,Llorar,"[Letra de ""Llorar""] [Verso 1: Joy Huerta] Me perdí buscando ese lugar Todo por tratar de demostrar Olvidé que sin tu amor no valgo nada Y tomé una vuelta equivocada [Pre-Coro: Mario Domm, Ambos] Me quedé sin movimiento Sin saber por dónde regresar Lleno de remordimiento Dejándote detrás, fingí ser alguien más [Coro: Joy Huerta & Mario Domm, Ambos] Y llorar (Y llorar), y llorar (Y llorar) No sirve de nada ahora que te perdí Te quiero recuperar Ven, sálvame, despiértame Rescátame del sufrimiento, oh, no Del sufrimiento [Verso 2: Mario Domm] Tengo la esperanza que el dolor Cambie y se transforme en tu perdón Navegar en un mar sin fantasmas Y la luz de tu amor sea mi mapa [Pre-Coro: Joy Huerta] Juro que es verdad, no miento Que mi voluntad es el cambiar Pero sola yo no puedo No sé cómo lograr mi alma reparar [Coro: Joy Huerta & Mario Domm, Ambos] Y llorar (Y llorar), y llorar (Y llorar) No sirve de nada ahora que te perdí Te quiero recuperar Ven, sálvame, despiértame Rescátame del sufrimiento Del sufrimiento, del sufrimiento Y llorar y llorar No sirve de nada ahora que te perdí Te quiero recuperar Ven sálvame, despiértame Rescátame del sufrimiento, oh Del sufrimiento, y llorar y llorar"
2961,Britney Spears - I Wanna Go,Britney Spears,2011,Pop,"['dance pop', 'pop']",dance pop,pop,Unknown,248021543,158722,,"[Verse 1] Lately, I've been stuck imagining What I wanna do and what I really think Time to blow out Be a little inappropriate 'Cause I know that everybody's thinking it When the light's out [Pre-Chorus] Shame on me To need release Un-un-uncontrollably [Chorus] I-I-I wanna go-oh-oh all the way-ay-ay Taking out my freak tonight I-I-I wanna sho-o-ow all the di-i-irt I got running through my mind, woah I-I-I wanna go-oh-oh all the way-ay-ay Taking out my freak tonight I-I-I wanna sho-o-ow all the di-i-irt I got running through my mind, woah [Verse 2] Lately, people got me all tied up There's a countdown waiting for me to erupt Time to blow out I've been told just what to do with it To keep both my hands above the bla-blanket When the light's out [Pre-Chorus] Shame on me To need release Un-un-uncontrollably [Chorus] I-I-I wanna go-oh-oh all the way-ay-ay Taking out my freak tonight I-I-I wanna sho-o-ow all the di-i-irt I got running through my  mind, woah I-I-I wanna go-oh-oh all the way-ay-ay Taking out my freak tonight I-I-I wanna sho-o-ow all the di-i-irt I got running through my mind, woah [Bridge] Sh-sh-sh-sh-sh-sh-shame on me (Shame on me) To need release (To need release) Un-un-un-uncontrollably (Uncontrollably, -lably, -lably, -lably...) [Chorus] I-I-I wanna go-oh-oh (I wanna go...) all the way-ay-ay Taking out my freak tonight I-I-I wanna sho-o-ow (I wanna show...) all the di-i-irt I got running through my mind I-I-I wanna go-oh-oh all the way-ay-ay Taking out my freak tonight I-I-I wanna sho-o-ow all the di-i-irt I got running through my mind, woah"
2913,Ed Sheeran - Small Bump,Ed Sheeran,2011,Pop,"['pop', 'singer-songwriter pop', 'uk pop']",pop,singer-songwriter pop,uk pop,247104894,22451,,"[Verse 1] You're just a small bump unborn In four months, you're brought to life You might be left with my hair But you'll have your mother's eyes I'll hold your body in my hands, be as gentle as I can But for now, you're a scan of my unmade plans A small bump, in four months, you're brought to life [Pre-Chorus] And I'll whisper quietly I'll give you nothin' but truth If you're not inside me I'll put my future in you [Chorus] You are my one and only And you can wrap your fingers 'round my thumb And hold me tight Oh, you are my one and only You can wrap your fingers 'round my thumb And hold me tight And you'll be all right [Verse 2] Ooh, you're just a small bump unknown, you'll grow into your skin With a smile like hers and a dimple beneath your chin Finger nails the size of a half grain of rice And eyelids closed to be soon opened wide A small bump, in four months, you'll open your eyes [Pre-Chorus] And I'll hold you tightly I'll tell you nothin' but truth If you're not inside me I'll put my future in you [Chorus] You are my one and only And you can wrap your fingers 'round my thumb And hold me tight Oh, you are my one and only You can wrap your fingers 'round my thumb And hold me tight And you'll be all right [Bridge] And you can lie with me With your tiny feet When you're half asleep I'll leave you be Right in front of me For a couple weeks So I can keep you safe [Chorus] 'Cause you are my one and only You can wrap your fingers 'round my thumb And hold me tight Oh, you are my one and only You can wrap your fingers 'round my thumb And hold me tight And you'll be all right [Outro] 'Cause you were just a small bump unborn For four months then torn from life Maybe you were needed up there But we're still unaware as why"
,Simple Plan - Summer Paradise,Simple Plan,2011,,,,,,244196852,77645,Summer Paradise,"[Intro: K'naan] Oh, oh Take me back, take me back (Oh, yeah) Back to summer paradise [Verse 1: Pierre Bouvier] My heart is sinkin' as I'm liftin' Up above the clouds away from you And I can't believe I'm leavin' Oh, I don't kno-kno-know what I'm gonna do [Pre-Chorus: Pierre Bouvier] But someday I will find my way back To where your name Is written in the sand [Chorus: Pierre Bouvier] 'Cause I remember every sunset I remember every word you said We were never gonna say goodbye Singing la-da-da-da-da Tell me how to get back to Back to summer paradise with you [Post-Chorus: Pierre Bouvier & K'naan] And I'll be there in a heartbeat (Heartbeat) Oh-oh I'll be there in a heartbeat (Heartbeat) Oh-oh (Tell 'em) [Verse 2: Pierre Bouvier, K'naan & Both] My soul is broken Streets are frozen I can't stop these feelings meltin' through And I'd give away a thousand days, oh Just to have another one with you (What'd you say?) Well, real life can wait (It can wait) We're crashin' like waves (Uh-huh) We're playin' in the sand (Me and you) Holding your hand, yeah, yeah, yeah [Chorus: Pierre Bouvier] 'Cause I remember every sunset (I remember) I remember every word you said We were never gonna say goodbye Singing la-da-da-da-da Tell me how to get back to Back to summer paradise with you [Post-Chorus: Pierre Bouvier & K'naan] And I'll be there in a heartbeat (Heartbeat) Oh-oh I'll be there in a heartbeat (Heartbeat) Oh-oh (Yeah, uh) [Verse 3: K'naan] I remember sunny mornings and summer evenings Now you're not next to me and I am freezin' Was it real? Oh, baby, tell me, was I dreamin'? How can you show me paradise when I'm leavin'? Now my heartbeat is sinking, hope's shrinking When I try to speak no words, lip-syncing Hope this is not just wishful thinking Tell me that you care and I'll be there in a heartbeat [Pre-Chorus: Pierre Bouvier & K'naan] Someday I will find my way back To where your name Is written in the sand Yeah, yeah, yeah, let's go [Chorus: Pierre Bouvier, K'naan & Both] 'Cause I remember every sunset (I remember) I remember every word you said We were never gonna say goodbye (No-no, no) Singing la-da-da-da-da Tell me how to get back to (Back to) Back to summer paradise with you (Yeah) And I'll be there in a heartbeat I remember when we first kissed (I remember) And how I didn't wanna leave your lips And how I've never ever felt so high (So high) Singing la-da-da-da-da So tell me how to get back to (Back to) Back to summer paradise with you [Post-Chorus: Pierre Bouvier & K'naan] And I'll be there in a heartbeat (Heartbeat; Yeah) Oh-oh And I'll be there in a heartbeat (Heartbeat; Summer paradise) Oh-oh I'll be there in a heartbeat"
2927,Wiz Khalifa - No Sleep,Wiz Khalifa,2011,Hip-Hop/Rap,"['hip hop', 'pittsburgh rap', 'pop rap', 'rap', 'southern hip hop', 'trap']",hip hop,pittsburgh rap,pop rap,239836220,65312,,"[Verse 1] Last night I let the party get the best of me Waking up in the morning, two hoes laying next to me Plus I heard an officer arrested me Good weed and cold drinks That's the motherfucking recipe Nigga and we roll deep, so deep It's going down in this bitch; concrete We gon' party all night, no sleep Tell the owner them is all my guys So tonight everything is on me [Pre-Hook 1] The drinks is on me The bitches, the hotel, the weed is all free Get high, I mean so high we don't see the whole suite Then fly to a level where you gon' need your own key T—G—O—D [Hook] No driving, no sleeping Live it up like it's the weekend When the DJ play the right song Gon' drink, gon' party all night long No driving, no sleeping Live it up like it's the weekend When the DJ play the right song Gon' drink, gon' party all night long [Verse 2] Leaving from the club, now she wanna stay with us Came to spend it all, don't care what I'm paying for Used to be too young, now I'm out here buying the bar Every time I look up, it's another red cup Bunch of niggas in the game, but they ain't playin' with us They ain't paying enough Man, them niggas ain't ballin' They just laying it up Saying they does I'm just rolling hella weed up While on my way to the club I had to wait at the club But now I don't 'Cause everything is on me [Pre-Hook 2] The drinks is on me The bitches, the hotel, the weed is all free Get high, I mean so high we see the whole street We fly, I mean so fly we need a whole wing T—G—O—D [Hook] No driving, no sleeping Live it up like it's the weekend When the DJ play the right song Gon' drink, gon' party all night long No driving, no sleeping Live it up like it's the weekend When the DJ play the right song Gon' drink, gon' party all night long [Bridge] Party all day, party all night Say you wanna party, let's party, alright I, party all day, party all night Say you wanna party, let's party, alright I, party all day, party all night Say you wanna party, let's party, alright I, party all day, party all night Say you wanna party, let's party, alright, I [Hook] No driving, no sleeping Live it up like it's the weekend When the DJ play the right song Gon' drink, gon' party all night long No driving, no sleeping Live it up like it's the weekend When the DJ play the right song Gon' drink, gon' party all night long [Outro] Party all day, party all night Say you wanna party, let's party, alright"
2947,Rodney Atkins - Take A Back Road,Rodney Atkins,2011,World/Traditional,"['contemporary country', 'country', 'country road']",contemporary country,country,country road,239168745,61988,,"[Verse 1] Sit in that six-lane backed up traffic Horns are honking, I've about had it I'm looking for an exit sign Gotta get out of here, get it all off my mind And like a memory from your grandpa's attic A song comes slippin' through the radio static Changing my mood A little George Strait 1982 [Chorus] And it makes me wanna take a back road Makes me wanna take the long way home Put a little gravel in my travel Unwind, unravel all night long Makes me wanna grab my honey Tear down some two-lane country Who knows Get lost and get right with my soul Makes me wanna take Makes me wanna take a back road [Verse 2] I've been cooped up, tied down, 'bout forgotten What a field looks like, full of corn and cotton If I'm gonna hit a traffic jam Well it better be a tractor man So sick and tired of this interstate system I need a curve and wind-a-twistin' Dusty path to nowhere With the wind blowing through my baby's hair [Chorus] Yeah, makes me wanna take a back road Makes me wanna take the long way home Put a little gravel in my travel Unwind, unravel all night long Makes me wanna grab my honey Tear down some two-lane country Who knows Get lost and get right with my soul Makes me wanna take Makes me wanna take a back road Some old back road [Bridge] Maybe it's the feeling or maybe it's the freedom Maybe it's that shady spot Where we park the truck when the things get hot Where we park the truck when the things get hot [Chorus] And it makes me wanna take a back road Makes me wanna take the long way home Put a little gravel in my travel Unwind, unravel all night long Makes me wanna grab you honey Tear down some two-lane country Who knows Get lost and get right with my soul Makes me wanna take Makes me wanna take a back road Some old back road, get right with my soul Now all I gotta do is take some old back road (Some old back road) to the shady spot where things get hot (Some old back road) way down, way down Way down some old back road"
